### ISSUE TITLE
UDP services don't work with managed networking

### ISSUE THREAD

**Issue by msh100** [rancher/rancher#3092]
I am having issues with managed networking for a UDP service I have. If I run the same service with a bridged Docker network however it works without an issue. The service is unusable on managed networking.

I suspect this is caused as the source of the reply UDP packets is not the same as the destination of the sending packets.

Example from TCP dump:

```
12:41:11.907807 IP $REMOTE.7130 > $LOCAL.27960: UDP, length 12
12:41:11.907976 IP $REMOTE.7130 > $LOCAL.27960: UDP, length 25
12:41:11.908214 IP $REMOTE.7130 > $LOCAL.27960: UDP, length 8
12:41:11.908478 IP $REMOTE.7130 > $LOCAL.27960: UDP, length 14
12:41:11.908491 IP $REMOTE.7130 > $LOCAL.27960: UDP, length 11
12:41:11.908704 IP $REMOTE.7130 > $LOCAL.27960: UDP, length 14
12:41:11.908716 IP $REMOTE.7130 > $LOCAL.27960: UDP, length 15
12:41:11.908875 IP $REMOTE.7130 > $LOCAL.27961: UDP, length 5
12:41:11.908906 IP $REMOTE.7130 > $LOCAL.27960: UDP, length 5
12:41:11.909100 IP $REMOTE.7130 > $LOCAL.27961: UDP, length 5
12:41:11.909370 IP $REMOTE.7130 > $LOCAL.27960: UDP, length 6
12:41:11.909673 IP $REMOTE.7130 > $LOCAL.27960: UDP, length 10
12:41:11.910304 IP $REMOTE.7130 > $LOCAL.27960: UDP, length 29
12:41:11.910501 IP $REMOTE.7130 > $LOCAL.8010: UDP, length 31
12:41:11.911843 IP $LOCAL.1024 > $REMOTE.7130: UDP, length 268
12:41:11.911978 IP $LOCAL.1024 > $REMOTE.7130: UDP, length 762
12:41:11.912088 IP $LOCAL.1024 > $REMOTE.7130: UDP, length 762
12:41:11.912110 IP $LOCAL.1024 > $REMOTE.7130: UDP, length 14
12:41:11.912118 IP $LOCAL.1024 > $REMOTE.7130: UDP, length 14
12:41:11.912127 IP $LOCAL.1024 > $REMOTE.7130: UDP, length 14
12:41:11.912134 IP $LOCAL.1024 > $REMOTE.7130: UDP, length 14
```

(I have removed hostnames).

On a bridged network, traffic from the `$LOCAL` to `$REMOTE` would be port `27960`, not `1024` as the managed network provided.

**Comment by mcuadros** [comment]
This issue is the problem why DNS services are not working as is explained at: https://github.com/rancher/rancher/issues/3036

This issues is causing to not having name resolution on any container with "Managed" network.

**Comment by miv** [comment]
I'm having a trouble with UDP as well - incoming traffic is registering but nothing going out. Setting to host networking solved this problem.

**Comment by AKoetsier** [comment]
Is there a known workaround without setting the network to host?

**Comment by leodotcloud** [comment]
@miv , @AKoetsier : Can you please share your setup details?

**Rancher Version:**

**Docker Version:**

**OS and where are the hosts located? (cloud, bare metal, etc):**

**Setup Details: (single node rancher vs. HA rancher, internal DB vs. external DB)**

**Environment Type: (Cattle/Kubernetes/Swarm/Mesos)**

**Steps to Reproduce:**

**Results:**

**Expected:**

**Comment by bbradbury** [comment]
We have this issue on Cattle, and it's a show stopper for us-- no UDP, this kills the programmer. Going to see if I can get more details than that @leodotcloud , but I believe we're on current releases of Docker, Rancher, and Cattle hosted on Ubuntu 16. Steps to reproduce are try deploy a service that speaks UDP (statsd for us), and it doesn't work.

**Comment by AKoetsier** [comment]
Rancher Version: 1.0.2
Docker Version: 1.10.3
OS: RancherOS 0.4.5 on AWS EC2
Setup Details: Single node rancher with external DB (RDS)
Environment Type: Cattle
Steps to reproduce: Deploy a service with managed networking that communicates over UDP to other (external) services.
Results: UDP packets from external applications/services are reaching the application, however outgoing UDP responses from the service deployed in rancher are never received by the other application.
Expected: UDP Packets that are being send should reach their endpoint :)

Current workaround mentioned here is to let the service use host-based networking.

**Comment by cooperaj** [comment]
Last week I spent the good part of a day wrestling with Logspout + Logstash in my Rancher environment. Just as I went home it twigged that the reason I was getting partial logs was because the only host that was logging was the one with logstash on it. 

It appears that the 500/UDP  traffic was not traversing the managed network at all. 

Heres the thing though, at some point over the weekend it seems to have sprung into life and now logspout traffic is being routed. It was the weekend, so no work was being done - I literally have no  idea what changed in order to cause the UDP traffic to suddenly start working.

**Comment by leodotcloud** [comment]
@miv @AKoetsier @cooperaj 
I have just setup a cluster on AWS and deployed an NGINX container with a simple UDP server running inside with the ports exposed. I see the traffic going through. Also I ran the UDP server on a different cloud server and connected from inside this nginx container and that worked too. I had to open the port on AWS for the server to be able to get the traffic from outside.

Here is the simple udp server/client from someone: https://gist.github.com/omnisis/3998752
Did a tcpdump and I can see the UDP traffic.

I am not able to reproduce the issue, if you have a catalog item or more specific instructions for me to recreate, I will be able to debug.

**Comment by cooperaj** [comment]
@leodotcloud I'm not running a catalog item I can readily link I'm afraid. I am just attempting to run an ELK stack with logspout doing container log scraping and pushing that to logstash.

The only host that registers any container logs into the system is the one running logstash.

**Comment by leodotcloud** [comment]
If you are still facing issues, please re-open with steps to reproduce.
