### ISSUE TITLE
I/O Timeout when using test logging function from Rancher UI

### ISSUE THREAD

**Issue by panlith** [rancher/rancher#23563]
**What kind of request is this (question/bug/enhancement/feature request):**
bug

**Steps to reproduce (least amount of steps as possible):**
In digitalocean setup a host running Rancher OS(tested on v1.5.4), install k8s on it with RKE(tested on v0.2.8) and then Rancher(tested on v2.2.8) via Helm.

In digitalocean, setup syslog(tested on 3.24) container on another host. Host listens for TCP on port 5569 and forwards to syslog container at port 601.

On Rancher configure cluster logging using Syslog protocol, specify syslog's host private IP address(x.x.x.x:5569), select transport protocol TCP and hist Test. 

Note that tests have been performed also with rke v.0.3.1 and Rancher v2.3.1, however same behavior when using Rancher OS occurs.

**Result:**
-Test always fails with timeout message like:
```
"couldn't read data from syslog 10.131.39.127:5569: couldn't read data from remote server: read tcp 10.42.0.10:45418->10.131.39.127:5569: i/o timeout"
```
-Repeat the same test but use Ubuntu host(e.g. ubuntu-16-04-x64) instead of Rancher OS and the test logging always succeeds. 

-Note that there is no impact on log collection, its just the test that fails.

**Environment information**
- Rancher version (`rancher/rancher`/`rancher/server` image tag or shown bottom left in the UI):
 rancher/rancher v2.2.8

- Installation option (single install/HA):
HA with one node with all roles(etcd,worker,control plane)

**Cluster information**
- Cluster type (Hosted/Infrastructure Provider/Custom/Imported):
Imported

- Machine type (cloud/VM/metal) and specifications (CPU/memory):
Digital ocean droplets used with private networking enabled.

- Kubernetes version (use `kubectl version`):
```
Server Version: version.Info{Major:"1", Minor:"14", GitVersion:"v1.14.6", GitCommit:"96fac5cd13a5dc064f7d9f4f23030a6aeface6cc", GitTreeState:"clean", BuildDate:"2019-08-19T11:05:16Z", GoVersion:"go1.12.9", Compiler:"gc", Platform:"linux/amd64"}
```

- Docker version (use `docker version`):

```
Rancher OS node:

docker version
Client: Docker Engine - Community
 Version:           18.09.2
 API version:       1.39
 Go version:        go1.10.8
 Git commit:        6247962
 Built:             Sun Feb 10 04:11:47 2019
 OS/Arch:           linux/amd64
 Experimental:      false

Server: Docker Engine - Community
 Engine:
  Version:          18.09.2
  API version:      1.39 (minimum version 1.12)
  Go version:       go1.10.6
  Git commit:       6247962
  Built:            Sun Feb 10 04:20:28 2019
  OS/Arch:          linux/amd64
  Experimental:     false


Syslog node:

docker version
Client: Docker Engine - Community
 Version:           19.03.3
 API version:       1.39 (downgraded from 1.40)
 Go version:        go1.12.10
 Git commit:        a872fc2f86
 Built:             Tue Oct  8 00:59:59 2019
 OS/Arch:           linux/amd64
 Experimental:      false

Server: Docker Engine - Community
 Engine:
  Version:          18.09.9
  API version:      1.39 (minimum version 1.12)
  Go version:       go1.11.13
  Git commit:       039a7df
  Built:            Wed Sep  4 16:19:38 2019
  OS/Arch:          linux/amd64
  Experimental:     false
```

Syslog configuration:

```
@version: 3.24
@include "scl.conf"
options {
time-reap(30);
mark-freq(10);
keep-hostname(yes);
};
source s_network {
network(
transport("tcp")
port("601")
flags(syslog-protocol)

);
};
log {
source(s_network);
};
```

- Data collected:

2 data sets already collected. Used tcpdump command syntax:
`tcpdump -nni eth1 -s0 port 5569`

[captures.zip](https://github.com/rancher/rancher/files/3750632/captures.zip)

a) Concurrent captures on syslog host and rancher pod, along with syslog server's output.

Syslog server output:
```
[2019-10-21T10:17:07.390820] Syslog connection accepted; fd='22', client='AF_INET(10.131.7.53:54388)', local='AF_INET(0.0.0.0:601)'
[2019-10-21T10:17:07.391065] Incoming log entry; line='<7>1 2019-10-21T10:17:07Z rancher-797f8646f6-zwpbg rancher 7 1fe097 [] Rancher logging target setting validated'
[2019-10-21T10:17:09.391370] Syslog connection closed; fd='22', client='AF_INET(10.131.7.53:54388)', local='AF_INET(0.0.0.0:601)'
```
Files:
sysloghost1.pcap
ranchercontainer.pcap

Error in UI:
<img width="1290" alt="image" src="https://user-images.githubusercontent.com/55960073/67204223-efb25880-f404-11e9-9583-859da505b0f4.png">

b) Concurrent captures on syslog host and Rancher OS host, along with syslog server's output.

Syslog server output:
```
[2019-10-21T11:10:57.470799] Syslog connection accepted; fd='22', client='AF_INET(10.131.7.53:45418)', local='AF_INET(0.0.0.0:601)'
[2019-10-21T11:10:57.471116] Incoming log entry; line='<5>1 2019-10-21T11:10:57Z rancher-797f8646f6-zwpbg rancher 7 ae3727 [] Rancher logging target setting validated'
[2019-10-21T11:10:59.471225] Syslog connection closed; fd='22', client='AF_INET(10.131.7.53:45418)', local='AF_INET(0.0.0.0:601)'
```
Files:
ros-host.pcap
sysloghost2.pcap

Error in UI:
<img width="1293" alt="image" src="https://user-images.githubusercontent.com/55960073/67204272-12447180-f405-11e9-8974-62543ff498bb.png">

**Other details that may be helpful:**

Wonder if this could this be somehow related:
The [readDataWithTimeout](https://github.com/rancher/rancher/blob/master/pkg/controllers/user/logging/utils/testwrap.go#L273) function appears that waits for a response from the syslog server which will never happen.

**Comment by axeal** [comment]
Based upon my testing this error can be reproduced when running Rancher in a Kubernetes cluster, but not when running Rancher as a single Docker container.

**Steps to reproduce (least amount of steps as possible):**

1. Provision an Ubuntu 18.04 LTS instance in Digital Ocean and install Docker `curl https://releases.rancher.com/install-docker/19.03.sh | bash`
2. Create a `syslog-ng.conf` file in the PWD, with the following contents:

```
@version: 3.27

source s_network {
    network(
        transport("tcp")
    );
};

destination d_stdout { file("/dev/stdout"); };

log { source(s_network); destination(d_stdout); };
```

3. Start a syslog-ng server: `docker run -it --net=host -v "$PWD/syslog-ng.conf":/etc/syslog-ng/syslog-ng.conf --name syslog --privileged balabit/syslog-ng:latest`

4. Provision a Rancher v2.4.4 instance on Docker, with a single all role node custom cluster in Digital Ocean, using https://github.com/superseb/tf-do-rancher2/

5. Provision a Rancher v2.4.4 instance on a single node RKE cluster in Digital Ocean, with RKE v1.1.3, using https://github.com/axeal/tf-do-rke

6. Attempt to configure cluster log forwarding within Rancher for the custom cluster attached to the Docker instance, and in the local cluster for the RKE instance, with the public IP of the syslog node, port 514 and TCP protocol. Click `Test`.

**Result:**

The Test works for the custom cluster attached to the single Docker container instance, but fails with the following error for the local cluster in the RKE install:

```
couldn't read data from syslog 161.35.158.157:514: couldn't read data from remote server: read tcp 10.42.0.14:52988->161.35.158.157:514: i/o timeout
```

Log forwarding itself works in both instances once the settings are saved.

tcpdump output from the single node RKE install when performing the test (10.42.0.14 is the Pod IP of the cluster-agent, 161.35.158.157 is the IP of the syslog host, 161.35.82.50 is the IP of the single node in the Rancher cluster):

```
root@aseymour-rke-all-0:~# tcpdump -pni any port 514
tcpdump: verbose output suppressed, use -v or -vv for full protocol decode
listening on any, link-type LINUX_SLL (Linux cooked), capture size 262144 bytes
09:56:51.584236 IP 10.42.0.14.52988 > 161.35.158.157.514: Flags [S], seq 1190614340, win 28200, options [mss 1410,sackOK,TS val 17135332 ecr 0,nop,wscale 7], length 0
09:56:51.584285 IP 161.35.82.50.40188 > 161.35.158.157.514: Flags [S], seq 1190614340, win 28200, options [mss 1410,sackOK,TS val 17135332 ecr 0,nop,wscale 7], length 0
09:56:51.586313 IP 161.35.158.157.514 > 161.35.82.50.40188: Flags [S.], seq 2324139342, ack 1190614341, win 28960, options [mss 1460,sackOK,TS val 782644465 ecr 17135332,nop,wscale 7], length 0
09:56:51.586351 IP 161.35.158.157.514 > 10.42.0.14.52988: Flags [S.], seq 2324139342, ack 1190614341, win 28960, options [mss 1460,sackOK,TS val 782644465 ecr 17135332,nop,wscale 7], length 0
09:56:51.586387 IP 10.42.0.14.52988 > 161.35.158.157.514: Flags [.], ack 1, win 221, options [nop,nop,TS val 17135333 ecr 782644465], length 0
09:56:51.586396 IP 161.35.82.50.40188 > 161.35.158.157.514: Flags [.], ack 1, win 221, options [nop,nop,TS val 17135333 ecr 782644465], length 0
09:56:51.586578 IP 10.42.0.14.52988 > 161.35.158.157.514: Flags [P.], seq 1:113, ack 1, win 221, options [nop,nop,TS val 17135333 ecr 782644465], length 112
09:56:51.586592 IP 161.35.82.50.40188 > 161.35.158.157.514: Flags [P.], seq 1:113, ack 1, win 221, options [nop,nop,TS val 17135333 ecr 782644465], length 112
09:56:51.586855 IP 161.35.158.157.514 > 161.35.82.50.40188: Flags [.], ack 113, win 227, options [nop,nop,TS val 782644466 ecr 17135333], length 0
09:56:51.586868 IP 161.35.158.157.514 > 10.42.0.14.52988: Flags [.], ack 113, win 227, options [nop,nop,TS val 782644466 ecr 17135333], length 0
09:56:53.586834 IP 10.42.0.14.52988 > 161.35.158.157.514: Flags [F.], seq 113, ack 1, win 221, options [nop,nop,TS val 17135833 ecr 782644466], length 0
09:56:53.586872 IP 161.35.82.50.40188 > 161.35.158.157.514: Flags [F.], seq 113, ack 1, win 221, options [nop,nop,TS val 17135833 ecr 782644466], length 0
09:56:53.587530 IP 161.35.158.157.514 > 161.35.82.50.40188: Flags [F.], seq 1, ack 114, win 227, options [nop,nop,TS val 782646467 ecr 17135833], length 0
09:56:53.587561 IP 161.35.158.157.514 > 10.42.0.14.52988: Flags [F.], seq 1, ack 114, win 227, options [nop,nop,TS val 782646467 ecr 17135833], length 0
09:56:53.587598 IP 10.42.0.14.52988 > 161.35.158.157.514: Flags [.], ack 2, win 221, options [nop,nop,TS val 17135833 ecr 782646467], length 0
09:56:53.587607 IP 161.35.82.50.40188 > 161.35.158.157.514: Flags [.], ack 2, win 221, options [nop,nop,TS val 17135833 ecr 782646467], length 0
```

tcpdump from the single node in the custom cluster attached to the Docker container Rancher instance, when performing the test (10.42.0.6 is the Pod IP of the cluster-agent, 161.35.158.157 is the IP of the syslog host, 142.93.232.226 is the IP of the single custom cluster node):

```
root@aseymour-rancheragent-all-0:~# tcpdump -pni any port 514
tcpdump: verbose output suppressed, use -v or -vv for full protocol decode
listening on any, link-type LINUX_SLL (Linux cooked), capture size 262144 bytes
10:01:43.878085 IP 10.42.0.6.45332 > 161.35.158.157.514: Flags [S], seq 119777255, win 28200, options [mss 1410,sackOK,TS val 3165287677 ecr 0,nop,wscale 7], length 0
10:01:43.878142 IP 142.93.232.226.38083 > 161.35.158.157.514: Flags [S], seq 119777255, win 28200, options [mss 1410,sackOK,TS val 3165287677 ecr 0,nop,wscale 7], length 0
10:01:43.880007 IP 161.35.158.157.514 > 142.93.232.226.38083: Flags [S.], seq 3475254903, ack 119777256, win 28960, options [mss 1460,sackOK,TS val 289696400 ecr 3165287677,nop,wscale 7], length 0
10:01:43.880054 IP 161.35.158.157.514 > 10.42.0.6.45332: Flags [S.], seq 3475254903, ack 119777256, win 28960, options [mss 1460,sackOK,TS val 289696400 ecr 3165287677,nop,wscale 7], length 0
10:01:43.880089 IP 10.42.0.6.45332 > 161.35.158.157.514: Flags [.], ack 1, win 221, options [nop,nop,TS val 3165287679 ecr 289696400], length 0
10:01:43.880101 IP 142.93.232.226.38083 > 161.35.158.157.514: Flags [.], ack 1, win 221, options [nop,nop,TS val 3165287679 ecr 289696400], length 0
10:01:43.880453 IP 10.42.0.6.45332 > 161.35.158.157.514: Flags [P.], seq 1:101, ack 1, win 221, options [nop,nop,TS val 3165287680 ecr 289696400], length 100
10:01:48.878031 IP 10.42.0.6.45332 > 161.35.158.157.514: Flags [F.], seq 101, ack 1, win 221, options [nop,nop,TS val 3165292677 ecr 289696401], length 0
10:01:48.878049 IP 142.93.232.226.38083 > 161.35.158.157.514: Flags [F.], seq 101, ack 1, win 221, options [nop,nop,TS val 3165292677 ecr 289696401], length 0
10:01:48.878634 IP 161.35.158.157.514 > 142.93.232.226.38083: Flags [F.], seq 1, ack 102, win 227, options [nop,nop,TS val 289701399 ecr 3165292677], length 0
10:01:48.878646 IP 161.35.158.157.514 > 10.42.0.6.45332: Flags [F.], seq 1, ack 102, win 227, options [nop,nop,TS val 289701399 ecr 3165292677], length 0
10:01:48.878656 IP 10.42.0.6.45332 > 161.35.158.157.514: Flags [.], ack 2, win 221, options [nop,nop,TS val 3165292678 ecr 289701399], length 0
10:01:48.878670 IP 142.93.232.226.38083 > 161.35.158.157.514: Flags [.], ack 2, win 221, options [nop,nop,TS val 3165292678 ecr 289701399], length 0
```
