### ISSUE TITLE
Intermittent connection issues to kubernetes API

### ISSUE THREAD

**Issue by dbason** [rancher/rancher#10288]
We are seeing frequent connection issues to the apiserver inside our kubernetes environments in Rancher.

E.g.:
```E1103 02:34:53.839563 5 leaderelection.go:253] error retrieving resource lock nginx-ingress/ingress-controller-leader-nginx: Get https://172.19.0.1:443/api/v1/namespaces/nginx-ingress/configmaps/ingress-controller-leader-nginx: read tcp 172.18.8.82:39570->172.19.0.1:443: read: connection reset by peer```

```2017/11/03 01:30:45 uninstall: Failed deletion of “redacted”: Delete https://172.19.0.1:443/api/v1/persistentvolumes/redacted: read tcp 172.18.176.125:60152->172.19.0.1:443: read: connection reset by peer```

The biggest issue with this is it is causing Helm deployments to fail.  We have tested a kubeadm kubernetes cluster in the same network and don't see this issue.  We are using Centos7 with Docker 1.12.6

---
| Useful | Info |
| :-- | :-- |
|Versions|Rancher `v1.6.10` Cattle: `v0.183.22` UI: `v1.6.23` |
|Access|`ldap` `admin`|
|Orchestration|`Kubernetes`|
|Route|`hosts.index`|

**Comment by aemneina** [comment]
After looking at the system we determined there was an issue with the overlay and underlying network which caused a large amount of packet re-transmits. This was determined by executing `cat /proc/net/xfrm_stat` on the ipsec containers and observing the `XfrmInStateSeqError` count being high.

**Comment by aemneina** [comment]
@dbason we were able to reproduce this... Packet captures showed duplicate packets when traversing the ipsec overlay network. Issue seems related to: https://github.com/kubernetes/kubernetes/issues/25793#issuecomment-221034631

Talking to @leodotcloud he's proposing to change ipsec to use (promiscuous=false and hairpin=true) on the interfaces.

**Comment by dbason** [comment]
If we do switch to hairpin mode wouldn't we be in danger of running into the kernel hang?  It seems that if we can find a way to mitigate the duplicate packets that would be the lesser of the two evils.

**Comment by aemneina** [comment]
@dbason we’ll definitely have to test this extensively before making any changes. The parameters exist to some degree in IPSec already, they’re not default values.

**Comment by leodotcloud** [comment]
Similar symptoms reported upstream: https://github.com/kubernetes/helm/issues/3273

**Comment by leodotcloud** [comment]
Information from the debugging session:

Error message:
```
Error: \
UPGRADE FAILED: \
Could not get information about the resource: \
Get https://172.19.0.1:443/api/v1/namespaces/default/configmaps/external-discovery-service-something01: \
read tcp 172.18.68.56:55230->172.19.0.1:443: read: connection reset by peer
```

Docker Subnet: `172.17.0.0/16`
Rancher Subnet: `172.18.0.0/16`
k8s cluster ip subnet: `172.19.0.0/16`


Host running k8s-api-server container:

docker0:

```
# ip addr show docker0
3: docker0: <BROADCAST,MULTICAST,PROMISC,UP,LOWER_UP> mtu 1500 qdisc noqueue state UP
    link/ether 02:42:35:db:e8:08 brd ff:ff:ff:ff:ff:ff
    inet 172.17.0.1/16 scope global docker0
       valid_lft forever preferred_lft forever
    inet 172.18.0.1/16 scope global docker0
       valid_lft forever preferred_lft forever
    inet6 fe80::42:35ff:fedb:e808/64 scope link
       valid_lft forever preferred_lft forever
```


ipsec:

```
3: eth0@if61: <BROADCAST,MULTICAST,UP,LOWER_UP> mtu 1500 qdisc noqueue state UP group default
    link/ether 02:e5:ec:ae:84:2d brd ff:ff:ff:ff:ff:ff link-netnsid 0
    inet 172.18.199.31/16 brd 172.18.255.255 scope global eth0
       valid_lft forever preferred_lft forever
```


k8s-api:

```
3: eth0@if71: <BROADCAST,MULTICAST,UP,LOWER_UP> mtu 1402 qdisc noqueue state UP group default
    link/ether 02:e5:ec:b0:73:d4 brd ff:ff:ff:ff:ff:ff link-netnsid 0
    inet 172.18.157.40/16 brd 172.18.255.255 scope global eth0
```


Host running tiller:

docker0:

```
3: docker0: <BROADCAST,MULTICAST,UP,LOWER_UP> mtu 1500 qdisc noqueue state UP
    link/ether 02:42:51:f3:c1:82 brd ff:ff:ff:ff:ff:ff
    inet 172.17.0.1/16 scope global docker0
       valid_lft forever preferred_lft forever
    inet 172.18.0.1/16 brd 172.18.255.255 scope global docker0
       valid_lft forever preferred_lft forever
    inet6 fe80::42:51ff:fef3:c182/64 scope link
       valid_lft forever preferred_lft forever
```


ipsec:

```
3: eth0@if11: <BROADCAST,MULTICAST,UP,LOWER_UP> mtu 1500 qdisc noqueue state UP group default
    link/ether 02:e5:ec:5f:0b:da brd ff:ff:ff:ff:ff:ff link-netnsid 0
    inet 172.18.127.191/16 brd 172.18.255.255 scope global eth0
```


tiller:

```
3: eth0@if19: <BROADCAST,MULTICAST,UP,LOWER_UP> mtu 1402 qdisc noqueue state UP group default
    link/ether 02:e5:ec:74:f1:af brd ff:ff:ff:ff:ff:ff link-netnsid 0
    inet 172.18.68.56/16 brd 172.18.255.255 scope global eth0
```



Relevant packet captures inside ipsec container running on tiller node:

```
15:23:37.181316 IP (tos 0x0, ttl 64, id 42404, offset 0, flags [DF], proto TCP (6), length 40)
    172.18.68.56.55230 > 172.18.157.40.6443: Flags [R], cksum 0x144a (correct), seq 142764197, win 0, length 0
	0x0000:  02e5 ec5f 0bda 02e5 ec74 f1af 0800 4500  ..._.....t....E.
	0x0010:  0028 a5a4 4000 4006 5ba6 ac12 4438 ac12  .(..@.@.[...D8..
	0x0020:  9d28 d7be 192b 0882 68a5 0000 0000 5004  .(...+..h.....P.
	0x0030:  0000 144a 0000                           ...J..
15:23:37.181336 IP (tos 0x0, ttl 64, id 42405, offset 0, flags [DF], proto TCP (6), length 40)
    172.18.68.56.55230 > 172.18.157.40.6443: Flags [R], cksum 0x144a (correct), seq 142764197, win 0, length 0
	0x0000:  02e5 ec5f 0bda 02e5 ec74 f1af 0800 4500  ..._.....t....E.
	0x0010:  0028 a5a5 4000 4006 5ba5 ac12 4438 ac12  .(..@.@.[...D8..
	0x0020:  9d28 d7be 192b 0882 68a5 0000 0000 5004  .(...+..h.....P.
	0x0030:  0000 144a 0000                           ...J..
15:23:37.181342 IP (tos 0x0, ttl 64, id 42406, offset 0, flags [DF], proto TCP (6), length 40)
    172.18.68.56.55230 > 172.18.157.40.6443: Flags [R], cksum 0x144a (correct), seq 142764197, win 0, length 0
	0x0000:  02e5 ec5f 0bda 02e5 ec74 f1af 0800 4500  ..._.....t....E.
	0x0010:  0028 a5a6 4000 4006 5ba4 ac12 4438 ac12  .(..@.@.[...D8..
	0x0020:  9d28 d7be 192b 0882 68a5 0000 0000 5004  .(...+..h.....P.
	0x0030:  0000 144a 0000                           ...J..
15:23:37.376218 IP (tos 0x0, ttl 64, id 27694, offset 0, flags [DF], proto TCP (6), length 90)
    172.18.68.56.55230 > 172.18.157.40.6443: Flags [P.], cksum 0x39d2 (incorrect -> 0x80a7), seq 142764159:142764197, ack 1819262016, win 1715, options [nop,nop,TS val 438045139 ecr 3522181588], length 38
	0x0000:  02e5 ec5f 0bda 02e5 ec74 f1af 0800 4500  ..._.....t....E.
	0x0010:  005a 6c2e 4000 4006 94ea ac12 4438 ac12  .Zl.@.@.....D8..
	0x0020:  9d28 d7be 192b 0882 687f 6c6f bc40 8018  .(...+..h.lo.@..
	0x0030:  06b3 39d2 0000 0101 080a 1a1c 09d3 d1f0  ..9.............
	0x0040:  39d4 1703 0300 213e 9aeb 5ce9 01b9 ad59  9.....!>..\....Y
	0x0050:  d471 a206 ff76 a3b7 4785 b533 6d7d 0aa8  .q...v..G..3m}..
	0x0060:  8562 c216 950e ae29                      .b.....)
15:23:37.376533 IP (tos 0x0, ttl 63, id 37160, offset 0, flags [DF], proto TCP (6), length 40)
    172.18.157.40.6443 > 172.18.68.56.55230: Flags [R], cksum 0x5cc1 (correct), seq 1819262016, win 0, length 0
	0x0000:  02e5 ec5f 0bda 0242 51f3 c182 0800 4500  ..._...BQ.....E.
	0x0010:  0028 9128 4000 3f06 7122 ac12 9d28 ac12  .(.(@.?.q"...(..
	0x0020:  4438 192b d7be 6c6f bc40 0000 0000 5004  D8.+..lo.@....P.
	0x0030:  0000 5cc1 0000                           ..\...
15:23:37.376541 IP (tos 0x0, ttl 62, id 37160, offset 0, flags [DF], proto TCP (6), length 40)
    172.18.157.40.6443 > 172.18.68.56.55230: Flags [R], cksum 0x5cc1 (correct), seq 1819262016, win 0, length 0
	0x0000:  02e5 ec74 f1af 02e5 ec5f 0bda 0800 4500  ...t....._....E.
	0x0010:  0028 9128 4000 3e06 7222 ac12 9d28 ac12  .(.(@.>.r"...(..
	0x0020:  4438 192b d7be 6c6f bc40 0000 0000 5004  D8.+..lo.@....P.
	0x0030:  0000 5cc1 0000
```


As we can see above, tiller container sent 3 reset packets [R] to the API server followed by a push [P.] packet. The API server responded with a reset packet [R] as expected.
But tiller seems to be expecting some data/response for the push packet, thereby throwing an error.

**Comment by leodotcloud** [comment]
conntracksync (network-manager) is missing the intelligence to identify the k8s cluster IP range and incorrectly deleting the entry related to tiller/k8s API ... causing the connection resets.

**Comment by leodotcloud** [comment]
https://github.com/rancher/rancher/issues/8207

**Comment by sangeethah** [comment]
Able to reproduce the issue with rancher-server v1.6.14 and K8s version - v1.8.5-rancher4

Had a LB service running on port 443.

Tried to install ghost using helm multiple times.
See the following intermittent issues:

```
Sangeethas-MBP:darwin-amd64 sangeethahariharan1$ ./helm install stable/ghost
NAME:   roiling-quail
Error: getting deployed release "roiling-quail": Get https://10.43.0.1:443/api/v1/namespaces/kube-system/configmaps?labelSelector=NAME%3Droiling-quail%2COWNER%3DTILLER: read tcp 10.42.138.92:46564->10.43.0.1:443: read: connection reset by peer
Sangeethas-MBP:darwin-amd64 sangeethahariharan1$ 
```

Following error seen in rancher/network-manager:v0.7.19 logs when helm installs is in progress:

```
1/31/2018 1:56:53 PMtime="2018-01-31T21:56:53Z" level=info msg="conntracksync: deleting mismatching DNAT conntrack entry found: {tcp 10.42.69.39 10.43.0.1 51126 443 10.42.187.82 10.42.69.39 6443 51126}. [expected: 10.42.78.132, got: 10.42.187.82]"
1/31/2018 1:56:53 PMtime="2018-01-31T21:56:53Z" level=error msg="conntracksync: error deleting the conntrack entry: exit status 1"
1/31/2018 1:56:53 PMconntrack v1.4.3 (conntrack-tools): 0 flow entries have been deleted.
1/31/2018 1:56:53 PMtime="2018-01-31T21:56:53Z" level=error msg="error deleting conntrack entry: exit status 1"
1/31/2018 1:56:53 PMtime="2018-01-31T21:56:53Z" level=error msg="conntracksync: error deleting the conntrack entry: exit status 1"
1/31/2018 1:56:59 PMtime="2018-01-31T21:56:59Z" level=info msg="CNI down: cid=5c026111f686065e88061e6f549fb03fec0c50f3e1bfcc4b24cb60e630700f1e networkMode=ipsec"
1/31/2018 1:57:04 PMtime="2018-01-31T21:57:04Z" level=info msg="conntracksync: deleting mismatching DNAT conntrack entry found: {tcp 10.42.138.92 10.43.0.1 51910 443 10.42.187.82 10.42.138.92 6443 51910}. [expected: 10.42.78.132, got: 10.42.187.82]"
1/31/2018 1:57:04 PMtcp      6 86399 ESTABLISHED src=10.42.138.92 dst=10.43.0.1 sport=51910 dport=443 src=10.42.187.82 dst=10.42.138.92 sport=6443 dport=51910 [ASSURED] mark=0 use=1
1/31/2018 1:57:04 PMconntrack v1.4.3 (conntrack-tools): 1 flow entries have been deleted.
1/31/2018 1:57:09 PMtime="2018-01-31T21:57:09Z" level=info msg="conntracksync: deleting mismatching DNAT conntrack entry found: {tcp 10.42.228.93 10.43.0.1 42914 443 10.42.187.82 10.42.228.93 6443 42914}. [expected: 10.42.78.132, got: 10.42.187.82]"
1/31/2018 1:57:09 PMtcp      6 5 CLOSE src=10.42.228.93 dst=10.43.0.1 sport=42914 dport=443 src=10.42.187.82 dst=10.42.228.93 sport=6443 dport=42914 [ASSURED] mark=0 use=1
1/31/2018 1:57:09 PMtcp      6 86396 ESTABLISHED src=10.42.228.93 dst=10.43.0.1 sport=42916 dport=443 src=10.42.187.82 dst=10.42.228.93 sport=6443 dport=42916 [ASSURED] mark=0 use=1
1/31/2018 1:57:09 PMconntrack v1.4.3 (conntrack-tools): 2 flow entries have been deleted.
1/31/2018 1:57:09 PMtime="2018-01-31T21:57:09Z" level=info msg="conntracksync: deleting mismatching DNAT conntrack entry found: {tcp 10.42.228.93 10.43.0.1 42916 443 10.42.187.82 10.42.228.93 6443 42916}. [expected: 10.42.78.132, got: 10.42.187.82]"
1/31/2018 1:57:09 PMconntrack v1.4.3 (conntrack-tools): 0 flow entries have been deleted.
1/31/2018 1:57:09 PMtime="2018-01-31T21:57:09Z" level=error msg="error deleting conntrack entry: exit status 1"
1/31/2018 1:57:09 PMtime="2018-01-31T21:57:09Z" level=error msg="conntracksync: error deleting the conntrack entry: exit status 1"
```

**Comment by sangeethah** [comment]
After upgrading to  v1.6.15-rc2 and K8s version - v1.9.2-rancher1-1 , I am not able to see the "connection reset by peer" issue anymore when connecting using helm.
But I dont see the "io.rancher.k8s.service.cluster.ip.range" label in the kubernetes service  which we expect to see.

Reopening this issue.

**Comment by sangeethah** [comment]
Tested with  v1.6.15-rc3 and K8s version - v1.9.2-rancher1-1.

Not able to see the "connection reset by peer" issue anymore when connecting using helm.

There is no "deleting mismatching DNAT conntrack entry found" in network-manager logs.
Instead we see the following logs where the 10.43.x.x ips get skipped
```
time="2018-02-01T04:28:14Z" level=debug msg="conntracksync: ip=10.43.0.10 is in excludedSubnets, skipping"
time="2018-02-01T04:28:14Z" level=debug msg="conntracksync: ip=10.43.0.1 is in excludedSubnets, skipping"
```
We see these for cluster ips of kube-dns, monitoring-influxdb and kubernetes service.

Also we see this label being present in the kubernetes service, which results in network-manager excluding 10.43.0.0 subnet:

"io.rancher.k8s.service.cluster.ip.range": "10.43.0.0/16"
