### ISSUE TITLE
UDP get erroneous Src Port on answers from services in rancher

### ISSUE THREAD

**Issue by fredriksvensson** [rancher/rancher#6494]
**Rancher Version:**
1.1.3

**Docker Version:**
1.12.1

**OS and where are the hosts located? (cloud, bare metal, etc):**
RancherOS, EC2

**Setup Details: (single node rancher vs. HA rancher, internal DB vs. external DB)**
HA rancher, external DB

**Environment Type: (Cattle/Kubernetes/Swarm/Mesos)**
Cattle

**Steps to Reproduce:**
https://gist.github.com/fredriksvensson/c30be017c5d7540bed33f907b2087e8a

Set correct ip address in client.go to send UDP messages into rancher container.

**Results:** 
Answers from the container in rancher get the Src Port rewritten to a faulty port, making answers to drop on arrival to the sender.

When running locally on docker with docker-compose this works as expected.

```
Frame 1: 43 bytes on wire (344 bits), 43 bytes captured (344 bits) on interface 0
Internet Protocol Version 4, Src: 192.168.99.119 (192.168.99.119), Dst: x.x.x.x (x.x.x.x)
User Datagram Protocol, Src Port: 33084 (33084), Dst Port: scp-config (10001)
    Source port: 33084 (33084)
    Destination port: scp-config (10001)
    Length: 9
    Checksum: 0x3566 [validation disabled]
        [Good Checksum: False]
        [Bad Checksum: False]
Data (1 byte)

Frame 2: 43 bytes on wire (344 bits), 43 bytes captured (344 bits) on interface 0
Internet Protocol Version 4, Src: x.x.x.x (x.x.x.x), Dst: 192.168.99.119 (192.168.99.119)
User Datagram Protocol, Src Port: 14593 (14593), Dst Port: 33084 (33084)
    Source port: 14593 (14593)
    Destination port: 33084 (33084)
    Length: 9
    Checksum: 0xe052 [validation disabled]
  `      [Good Checksum: False]
        [Bad Checksum: False]
Data (1 byte)
```

**Expected:**
```
User Datagram Protocol, Src Port: 33084 (33084), Dst Port: scp-config (10001)

User Datagram Protocol, Src Port: 10001 (10001), Dst Port: 33084 (33084)
```

**Comment by tobowers** [comment]
Just noting that I can confirm this problem as well: https://forums.rancher.com/t/udp-networking-stack-problems/4498

**Comment by nathHy** [comment]
Any updates on this ticket? I've got a similar issue and its preventing us from using rancher entirely unfortunately :(

**Comment by vincent99** [comment]
@leodotcloud Can you look at this, I've seen enough reports that there's probably something there.

**Comment by leodotcloud** [comment]
I am not able to reproduce this issue using `rancher/server:1.5.5`.

Launched two containers:

udpserver: with 10001:10001/udp (running the above `server.go`)
udpclient: with net=host (running the above `client.go`)

```
15:03:41.575888 IP (tos 0x0, ttl 64, id 25324, offset 0, flags [DF], proto UDP (
17), length 29)
    10.42.0.1.35771 > 10.42.206.40.10001: [bad udp cksum 0xe297 -> 0x3a92!] UDP,
 length 1
        0x0000:  02f2 e285 0706 0242 96c7 774a 0800 4500  .......B..wJ..E.
        0x0010:  001d 62ec 4000 4011 f566 0a2a 0001 0a2a  ..b.@.@..f.*...*
        0x0020:  ce28 8bbb 2711 0009 e297 30              .(..'.....0
15:03:41.576052 IP (tos 0x0, ttl 64, id 55723, offset 0, flags [DF], proto UDP (
17), length 29)
    10.42.206.40.10001 > 10.42.0.1.35771: [bad udp cksum 0xe297 -> 0x3a92!] UDP,
 length 1
        0x0000:  0242 96c7 774a 02f2 e285 0706 0800 4500  .B..wJ........E.
        0x0010:  001d d9ab 4000 4011 7ea7 0a2a ce28 0a2a  ....@.@.~..*.(.*
        0x0020:  0001 2711 8bbb 0009 e297 30              ..'.......0
15:03:42.576451 IP (tos 0x0, ttl 64, id 25614, offset 0, flags [DF], proto UDP (
17), length 29)
    10.42.0.1.35771 > 10.42.206.40.10001: [bad udp cksum 0xe297 -> 0x3992!] UDP,
 length 1
        0x0000:  02f2 e285 0706 0242 96c7 774a 0800 4500  .......B..wJ..E.

```

Things are working as expected.

**Comment by ScottiLXVI** [comment]
@leodotcloud I'm fairly new to Rancher but I just had this issue.  I'm making SNMP queries to servers outside my docker cluster. If I use the managed network it fails, but if I use Bridge, it works fine. I can map 7000:161/udp and have the same issue. I have to move it to bridge networking to fix it.

Docker version 17.03.1-ce, build c6d412e
Rancher 1.5.9

**Comment by marcuswelz** [comment]
I'm experiencing a similar issue to @ScottiLXVI, which I believe is different from the original issue reported by @fredriksvensson.

The original post was hosting a UDP server inside a container, exposing the UDP port, and being able to use a client (outside the network) to connect to it.

The issue @ScottiLXVI and I are experiencing are the reverse:

Using a client from within container on a managed network to connect to a UDP server elsewhere (outside the docker cluster), and not receiving replies.

Just for context, I'm making a UDP request to [Valve's Master Server](https://developer.valvesoftware.com/wiki/Master_Server_Query_Protocol) and am expecting a response, which it sends. This is working via docker-compose on Windows, Linux, Mac. It's also working via the Bridge network, but _not_ via the Managed network.

Per tcpdump:
```
graydoubt@overseer:~$ sudo tcpdump -i ens3 | grep -i udp | grep -v -i ipsec
08:49:12.161889 IP overseer.arkbrowser.com.41683 > 208-64-200-65.steampowered.com.27011: UDP, length 26
08:49:12.302566 IP 208-64-200-65.steampowered.com.27011 > overseer.arkbrowser.com.41683: UDP, length 1392
```

Looking at it from the docker0 interface:
```
graydoubt@overseer:~$ sudo tcpdump | grep -i udp | grep -v -i ipsec
tcpdump: verbose output suppressed, use -v or -vv for full protocol decode
listening on docker0, link-type EN10MB (Ethernet), capture size 262144 bytes
08:20:23.425137 IP 10.42.94.21.51842 > 208-64-200-65.steampowered.com.27011: UDP, length 26
08:20:23.563451 IP 208-64-200-65.steampowered.com.27011 > 10.42.94.21.51842: UDP, length 1392
```

The container:
```
bash-4.3# ifconfig
eth0      Link encap:Ethernet  HWaddr 02:7C:60:01:55:7C
          inet addr:10.42.94.21  Bcast:10.42.255.255  Mask:255.255.0.0
          UP BROADCAST RUNNING MULTICAST  MTU:1402  Metric:1
          RX packets:2819 errors:0 dropped:14 overruns:0 frame:0
          TX packets:138 errors:0 dropped:0 overruns:0 carrier:0
          collisions:0 txqueuelen:0
          RX bytes:978341 (955.4 KiB)  TX bytes:10036 (9.8 KiB)
```

The one thing I noticed is the dropped RX packets (14), and after each invocation of the program making the request, the dropped packets go up by 2.

I will try to put together a small script to reproduce this issue.

**Comment by marcuswelz** [comment]
This is with Rancher 1.6.14 on Docker 17.12.0-ce.

And I think this may be a packet size / MTU type issue.

This snippet reproduces it (running it from an alpine container with Perl installed on _Managed_ network):
```
perl -MSocket -e '
socket(my $socket, PF_INET, SOCK_DGRAM, 0) or die "socket: $!";
setsockopt($socket, SOL_SOCKET, SO_RCVTIMEO, pack("i4", 1, 0, 0, 0));
my $sockaddr = pack_sockaddr_in(27011, inet_aton("hl2master.steampowered.com"));
send($socket, "\x31\xFF0.0.0.0:0\x00\\appid\\346110\x00", 0, $sockaddr);
my $data = "";
recv($socket, $data, 1400, 0) or (print "Unable to query server\n" and exit(1));
print "Response received: $data\n";
'
```

Initially the payload was slightly different, with the server responding with a much smaller packet, but it was working:
```
bash-4.3# perl -MSocket -e '
> socket(my $socket, PF_INET, SOCK_DGRAM, 0) or die "socket: $!";
> setsockopt($socket, SOL_SOCKET, SO_RCVTIMEO, pack("i4", 1, 0, 0, 0));
> my $sockaddr = pack_sockaddr_in(27011, inet_aton("hl2master.steampowered.com"));
> send($socket, "\x31\x000.0.0.0:0\x00\\appid\\346110\x00", 0, $sockaddr);
> my $data = "";
> recv($socket, $data, 1400, 0) or (print "Unable to query server\n" and exit(1));
>
> print "Response received: $data\n";
> '
Response received: f
```

The corresponding tcpdump output:
```
09:59:16.373152 IP 10.42.97.253.47167 > 208-64-200-52.steampowered.com.27011: UDP, length 26
09:59:16.566689 IP 208-64-200-52.steampowered.com.27011 > 10.42.97.253.47167: UDP, length 12
```

If I change the script (changing payload from `\x31\x00`... to `\x31\xFF`...), the packet size is much bigger, and the response is no longer received:

```
bash-4.3# perl -MSocket -e '
> socket(my $socket, PF_INET, SOCK_DGRAM, 0) or die "socket: $!";
> setsockopt($socket, SOL_SOCKET, SO_RCVTIMEO, pack("i4", 1, 0, 0, 0));
> my $sockaddr = pack_sockaddr_in(27011, inet_aton("hl2master.steampowered.com"));
> send($socket, "\x31\xFF0.0.0.0:0\x00\\appid\\346110\x00", 0, $sockaddr);
> my $data = "";
> recv($socket, $data, 1400, 0) or (print "Unable to query server\n" and exit(1));
>
> print "Response received: $data\n";
> '
Unable to query server
```

The corresponding tcpdump output:

```
10:01:58.677587 IP 10.42.97.253.43068 > 208-64-200-39.steampowered.com.27011: UDP, length 26
10:01:58.904778 IP 208-64-200-39.steampowered.com.27011 > 10.42.97.253.43068: UDP, length 1392
```

Container:
```
bash-4.3# ip a | grep mtu
1: lo: <LOOPBACK,UP,LOWER_UP> mtu 65536 qdisc noqueue state UNKNOWN qlen 1
3: eth0@if213: <BROADCAST,MULTICAST,UP,LOWER_UP,M-DOWN> mtu 1402 qdisc noqueue state UP
```

Host:
```
$ ip a  | grep mtu
1: lo: <LOOPBACK,UP,LOWER_UP> mtu 65536 qdisc noqueue state UNKNOWN group default qlen 1
2: ens3: <BROADCAST,MULTICAST,UP,LOWER_UP> mtu 1500 qdisc pfifo_fast state UP group default qlen 1000
3: docker0: <BROADCAST,MULTICAST,PROMISC,UP,LOWER_UP> mtu 1500 qdisc noqueue state UP group default
```

**Comment by superseb** [comment]
Possibly related: https://github.com/rancher/rancher/issues/10498

However, I don't see the MTU going above the MTU set, so not sure yet.

**Comment by deniseschannon** [comment]
With the release of Rancher 2.0, development on v1.6 is only limited to critical bug fixes and security patches.
