### ISSUE TITLE
Containers on separate networks cannot talk to each other even if VPN tunnel exists

### ISSUE THREAD

**Issue by alejom99** [rancher/rancher#3681]
Below is our setup:

- 2 AWS VPCs (East and West)
- VPN tunnel between both VPCs using OpenVPN
- All hosts added to rancher using their private IPs (An AWS subnet provides each host with a public and private IP)
- Physical hosts can talk just fine using private IPs cross-VPC using the VPN tunnel.

Behavior:
- Each physical host can ping/talk to each other
- Any container within in VPC can talk to each other (containers in the East can talk to other containers in East, same for West)
- Containers in the East VPC cannot talk to containers in the West, and vice versa. 
- A container in East VPC can ping the IP of the physical host on the West VPC, and vice versa. So, in other words, a container on the west can communicate with a physical host on the East (using its private IP), but it cannot communicate with another container on that host on the East using the container IP on the 10.42.0.0 network.

We have tested all the configuration options we can think of on the network side and do not see anything that should be the culprit.
- The VPN tunnel routes correctly between both VPCs. We even added route 10.42.0.0 255.255.0.0 just to test and no luck
- 100% the security groups on the host machines are correct (UDP ports 500/4500 open, etc)

Trace route:
- Tracing route from container on VPC West to Physical Host IP on VPC East shows routing first to 172.17.., then to the VPN on the West, then to the VPN on East (as it should)
- Tracing route from container on VPC West to a container on VPC East, however, shows routing through 10.42.. and then just stops.

Additional info:
- We ran a test where we added two hosts to rancher using their public IPs, one to each VPC. Containers on those machines are able to successfully communicate cross-VPC.

Rancher Version: v0.59.0
Docker Version: 1.9.1
OS: Ubuntu 14.04

**Comment by ibuildthecloud** [comment]
Run a test from container A running on host A in West that pings container B on host H in East.  While the ping is running run tcpdump on both hosts.  What traffic do you see for UDP ports 4500 and 500.  Can you send the outputs?  Basically what are the source and destination IPs and is traffic primarily on port 500 or 4500?

**Comment by alejom99** [comment]
I performed the tests and here are the results:

Setup:
- VPC A (west) uses host with IP 172.32.0.111 to route traffic to East
- VPC B (East) uses host with IP 172.31.0.245 to route traffic to West
- Container A (network agent) in the west has IP 10.42.140.31
- Host A in the West has IP 172.32.1.179
- Container B (network agent) in the east has IP 10.42.23.35
- Host B in the East has ip 172.31.0.131

Test 1: Ping between containers
Results: No packages were captured through tcpdump

Test 2: Ping Host B from Container A
Results:

tcpdump from Host A
```
23:31:41.952659 IP 172.32.1.179 > 172.31.0.131: ICMP echo request, id 17775, seq 1, length 64
23:31:42.033539 IP 172.31.0.131 > 172.32.1.179: ICMP echo reply, id 17775, seq 1, length 64
23:31:42.952661 IP 172.32.1.179 > 172.31.0.131: ICMP echo request, id 17775, seq 2, length 64
23:31:43.034115 IP 172.31.0.131 > 172.32.1.179: ICMP echo reply, id 17775, seq 2, length 64
23:31:43.953251 IP 172.32.1.179 > 172.31.0.131: ICMP echo request, id 17775, seq 3, length 64
23:31:44.034174 IP 172.31.0.131 > 172.32.1.179: ICMP echo reply, id 17775, seq 3, length 64
23:31:44.953308 IP 172.32.1.179 > 172.31.0.131: ICMP echo request, id 17775, seq 4, length 64
23:31:45.034075 IP 172.31.0.131 > 172.32.1.179: ICMP echo reply, id 17775, seq 4, length 64
```

tcpdump from Host B

```
23:31:41.999008 IP 172.31.0.245 > 172.31.0.131: ICMP echo request, id 17775, seq 1, length 64
23:31:41.999052 IP 172.31.0.131 > 172.31.0.245: ICMP echo reply, id 17775, seq 1, length 64
23:31:42.999319 IP 172.31.0.245 > 172.31.0.131: ICMP echo request, id 17775, seq 2, length 64
23:31:42.999356 IP 172.31.0.131 > 172.31.0.245: ICMP echo reply, id 17775, seq 2, length 64
23:31:43.999626 IP 172.31.0.245 > 172.31.0.131: ICMP echo request, id 17775, seq 3, length 64
23:31:43.999675 IP 172.31.0.131 > 172.31.0.245: ICMP echo reply, id 17775, seq 3, length 64
23:31:44.999548 IP 172.31.0.245 > 172.31.0.131: ICMP echo request, id 17775, seq 4, length 64
23:31:44.999573 IP 172.31.0.131 > 172.31.0.245: ICMP echo reply, id 17775, seq 4, length 64
```

As you can see from the results, when I pin the Host B (East) from container in Host A (West), packets are being forwarded correctly through the VPN tunnel. But when I do the ping between containers, no packets are captured. 

As for traffic in ports 500 vs 4500, I'm seeing more traffic on port 4500 than 500, but no traffic between the East and West, only traffic within each region.

**Comment by leodotcloud** [comment]
@alejom99 : If you have any scripts to setup this kind of topology, I can try to recreate this issue at my end. (Or some steps from your .bashrc file). Also a snapshot of your openvpn configuration. The faster I can recreate the problem, the more time I can spend on debugging and root causing the issue.

**Comment by deniseschannon** [comment]
@alejom99 If you can provide the information requested, please re-open.
