### ISSUE TITLE
Rancher 2.2 rc2 - prometheus metrics unavailable

### ISSUE THREAD

**Issue by jbroq** [rancher/rancher#18441]
**What kind of request is this (question/bug/enhancement/feature request):**
bug

**Steps to reproduce (least amount of steps as possible):**
Enable cluster level monitoring with default option
Click on the etcd metrics of the cluster

**Result:**
you get a popup with:
```
query series failed, query range failed, Get http://prometheus-operated.cattle-prometheus:9090/api/v1/query_range?end=2019-02-27T08%3A47%3A46.442214178Z&query=sum%28rate%28node_network_transmit_packets_total%7Bdevice%21~%22lo%7Cveth.%2A%7Cdocker.%2A%7Cflannel.%2A%7Ccali.%2A%7Ccbr.%2A%22%7D%5B5m%5D%29%29+by+%28instance%29&start=2019-02-27T07%3A47%3A46.442214178Z&step=60.000: dial tcp 10.42.5.6:9090: i/o timeout, expression: sum(rate(node_network_transmit_packets_total{device!~"lo|veth.*|docker.*|flannel.*|cali.*|cbr.*"}[5m])) by (instance)
```
Pod: prometheus-cluster-monitoring-nginx
Container name : prometheus-proxy 
Container image : rancher/nginx:1.15.8-alpine
The container is started (green state) but contains the following error message :
```
/var/run/nginx-start.sh: line 7: ![: not found
2019/02/27 08:40:24 [warn] 11#11: duplicate MIME type "text/html" in /var/run/nginx.conf:50
nginx: [warn] duplicate MIME type "text/html" in /var/run/nginx.conf:50
```

Pod: prometheus-cluster-monitoring-nginx
Container name : prometheus-agent
Container image : rancher/prometheus-auth:v0.2.0
The container is started (green state) but contains the following error message :
```
INFO[2019-02-27T08:40:24Z] Start listening for connections on 10.42.5.6:9090

2019/02/27 08:40:37 http: proxy error: context canceled

2019/02/27 08:40:41 http: proxy error: context canceled

2019/02/27 08:40:47 http: proxy error: context canceled

2019/02/27 08:40:51 http: proxy error: context canceled

ERRO[2019-02-27T08:40:54Z] github.com/rancher/prometheus-auth/pkg/kube/namespaces.go:151: Failed to list *v1.Secret: Get https://10.43.0.1:443/api/v1/secrets?limit=500&resourceVersion=0: dial tcp 10.43.0.1:443: i/o timeout

ERRO[2019-02-27T08:40:54Z] github.com/rancher/prometheus-auth/pkg/kube/namespaces.go:152: Failed to list *v1.Namespace: Get https://10.43.0.1:443/api/v1/namespaces?limit=500&resourceVersion=0: dial tcp 10.43.0.1:443: i/o timeout

2019/02/27 08:40:57 http: proxy error: context canceled

2019/02/27 08:41:01 http: proxy error: context canceled
```

**Other details that may be helpful:**

**Environment information**
* Rancher version (`rancher/rancher`/`rancher/server` image tag or shown bottom left in the UI): 2.2.0-alpha6
* Installation option (single install/HA): single install
  No persistent storage

**Cluster information**
* Cluster type (Hosted/Infrastructure Provider/Custom/Imported): Hosted

* Machine type (cloud/VM/metal) and specifications (CPU/memory): VMware : 3 masters, 3 nodes, 2CPU/4GB/20GB HDD each

* Kubernetes version (use `kubectl version`): `1.13.1-Rancher`

* Centos version : `CentOS Linux release 7.6.1810 (Core)`

* Kernel version : 
```
uname -r
3.10.0-957.5.1.el7.x86_64
```

* Docker version (use `docker version`):
```
Client:
 Version:           18.09.2
 API version:       1.39
 Go version:        go1.10.6
 Git commit:        6247962
 Built:             Sun Feb 10 04:13:27 2019
 OS/Arch:           linux/amd64
 Experimental:      false

Server: Docker Engine - Community
 Engine:
  Version:          18.09.2
  API version:      1.39 (minimum version 1.12)
  Go version:       go1.10.6
  Git commit:       6247962
  Built:            Sun Feb 10 03:47:25 2019
  OS/Arch:          linux/amd64
  Experimental:     false

```

Thanks for your help

**Comment by thxCode** [comment]
@jbroq, Can you retry with `rancher/rancher:2.2-rc3` ? On the other hand, enabling Monitoring and have been through for a long time, if you still get the below tip on the main dashboard, you should validate the Kubernetes DNS service work or not. 

> `query series failed, query range failed, Get http://prometheus-operated.cattle-prometheus:9090/api/v1/query_range`

**Comment by jbroq** [comment]
@thxCode , thanks for your reply.

I am still having the issue with 2.2.0-rc6.

After many tests, my only clue is the prometheus-agent error.

```
> kubectl get endpoints -n cattle-prometheus
NAME                            ENDPOINTS                                                                  AGE
access-grafana                  10.42.5.3:80                                                               105m
access-prometheus               10.42.3.4:80                                                               105m
expose-grafana-metrics          10.42.5.3:3000                                                             105m
expose-kube-cm-metrics          MASTER1_IP:10252,MASTER2_IP:10252,MASTER3_IP:10252                105m
expose-kube-etcd-metrics        MASTER1_IP:2379,MASTER2_IP:2379,MASTER3_IP:2379                   105m
expose-kube-scheduler-metrics   MASTER1_IP:10251,MASTER2_IP:10251,MASTER3_IP:10251                105m
expose-kubelets-metrics         MASTER1_IP:10255,MASTER2_IP:10255,MASTER3_IP:10255 + 15 more...   102m
expose-kubernetes-metrics       10.42.3.3:8081,10.42.3.3:8080                                              105m
expose-node-metrics             MASTER1_IP:9796,MASTER2_IP:9796,MASTER3_IP:9796 + 3 more...       105m
expose-operator-metrics         10.42.5.2:8080                                                             105m
expose-prometheus-metrics       10.42.3.4:9090                                                             105m
prometheus-operated             10.42.3.4:9090                                                             105m
```

The pod prometheus-operated is accessible for the worker node on which it is deployed :
```
+1:  Out 17:20:17.278650 Out ee:ee:ee:ee:ee:ee ethertype IPv4 (0x0800), length 188: WORKER_IP.57894 > 10.42.3.4.websm: Flags [P.], seq 1:121, ack 1, win 229, options [nop,nop,TS val 17214350 ecr 17214350], length 120
E....   @.@.[?..!-
*...&#.Z.[................
........GET /-/healthy HTTP/1.1
Host: 10.42.3.4:9090
User-Agent: kube-probe/1.13
Accept-Encoding: gzip
Connection: close

................
17:20:17.278662  In fe:25:77:b9:12:f0 ethertype IPv4 (0x0800), length 68: 10.42.3.4.websm > WORKER_IP.57894: Flags [.], ack 121, win 227, options [nop,nop,TS val 17214350 ecr 17214350], length 0
E..418@.@...
*....!-#..&....Z.\......).....
........................
17:20:17.279318  In fe:25:77:b9:12:f0 ethertype IPv4 (0x0800), length 227: 10.42.3.4.websm > WORKER_IP.57894: Flags [P.], seq 1:160, ack 121, win 227, options [nop,nop,TS val 17214351 ecr 17214350], length 159
E...19@.@...
*....!-#..&....Z.\............
........HTTP/1.1 200 OK
Content-Length: 23
Content-Type: text/plain; charset=utf-8
Date: Mon, 18 Mar 2019 16:20:17 GMT
Connection: close

Prometheus is Healthy.
```

DNS seems to work.

That is confirmed by TCPDUMP :
```
17:57:25.781217 IP 10.42.4.3.52746 > 10.43.0.10.53: 8954+ AAAA? prometheus-operated.cattle-prometheus.cattle-system.svc.cluster.local. (87)
17:57:25.781255 IP 10.42.4.3.52746 > 10.42.3.2.53: 8954+ AAAA? prometheus-operated.cattle-prometheus.cattle-system.svc.cluster.local. (87)
17:57:25.781371 IP 10.42.4.3.53976 > 10.43.0.10.53: 311+ A? prometheus-operated.cattle-prometheus.cattle-system.svc.cluster.local. (87)
17:57:25.781386 IP 10.42.4.3.53976 > 10.42.3.2.53: 311+ A? prometheus-operated.cattle-prometheus.cattle-system.svc.cluster.local. (87)
17:57:30.781358 IP 10.42.4.3.42390 > 10.43.0.10.53: 62201+ AAAA? prometheus-operated.cattle-prometheus.cattle-system.svc.cluster.local. (87)
17:57:30.781391 IP 10.42.4.3.42390 > 10.42.3.2.53: 62201+ AAAA? prometheus-operated.cattle-prometheus.cattle-system.svc.cluster.local. (87)
17:57:30.781572 IP 10.42.4.3.41967 > 10.43.0.10.53: 31825+ A? prometheus-operated.cattle-prometheus.cattle-system.svc.cluster.local. (87)
17:57:30.781595 IP 10.42.4.3.41967 > 10.42.4.2.53: 31825+ A? prometheus-operated.cattle-prometheus.cattle-system.svc.cluster.local. (87)
17:57:30.781922 IP 10.42.4.2.53 > 10.42.4.3.41967: 31825 NXDomain 0/1/0 (180)
17:57:30.781935 IP 10.43.0.10.53 > 10.42.4.3.41967: 31825 NXDomain 0/1/0 (180)
17:57:35.781524 IP 10.42.4.3.36032 > 10.43.0.10.53: 37510+ AAAA? prometheus-operated.cattle-prometheus.svc.cluster.local. (73)
17:57:35.781564 IP 10.42.4.3.36032 > 10.42.4.2.53: 37510+ AAAA? prometheus-operated.cattle-prometheus.svc.cluster.local. (73)
17:57:35.781639 IP 10.42.4.3.55573 > 10.43.0.10.53: 23069+ A? prometheus-operated.cattle-prometheus.svc.cluster.local. (73)
17:57:35.781662 IP 10.42.4.3.55573 > 10.42.3.2.53: 23069+ A? prometheus-operated.cattle-prometheus.svc.cluster.local. (73)
17:57:35.781758 IP 10.42.4.2.53 > 10.42.4.3.36032: 37510 0/0/0 (73)
17:57:35.781773 IP 10.43.0.10.53 > 10.42.4.3.36032: 37510 0/0/0 (73)
17:57:35.781891 IP 10.42.4.3.55726 > 10.43.0.10.53: 21227+ AAAA? prometheus-operated.cattle-prometheus.svc.cluster.local. (73)
17:57:35.781912 IP 10.42.4.3.55726 > 10.42.3.2.53: 21227+ AAAA? prometheus-operated.cattle-prometheus.svc.cluster.local. (73)
17:57:40.782390 IP 10.42.4.3.48471 > 10.43.0.10.53: 63351+ A? prometheus-operated.cattle-prometheus.svc.cluster.local. (73)
17:57:40.782429 IP 10.42.4.3.48471 > 10.42.4.2.53: 63351+ A? prometheus-operated.cattle-prometheus.svc.cluster.local. (73)
17:57:40.782824 IP 10.42.4.2.53 > 10.42.4.3.48471: 63351* 1/0/0 A 10.42.3.4 (89)
17:57:40.782839 IP 10.43.0.10.53 > 10.42.4.3.48471: 63351* 1/0/0 A 10.42.3.4 (89)
```

What I see, is that the prometheus-agent is not answering to requests
```
18:02:23.982458 IP 10.42.4.3.45860 > 10.42.3.4.9090: Flags [S], seq 2417066922, win 29200, options [mss 1460,sackOK,TS val 19741050 ecr 0,nop,wscale 7], length 0
18:02:23.982514 IP 10.42.4.3.45860 > 10.42.3.4.9090: Flags [S], seq 2417066922, win 29200, options [mss 1460,sackOK,TS val 19741050 ecr 0,nop,wscale 7], length 0
18:02:23.982595 IP 10.42.4.3.45862 > 10.42.3.4.9090: Flags [S], seq 3062027549, win 29200, options [mss 1460,sackOK,TS val 19741050 ecr 0,nop,wscale 7], length 0
18:02:23.982610 IP 10.42.4.3.45862 > 10.42.3.4.9090: Flags [S], seq 3062027549, win 29200, options [mss 1460,sackOK,TS val 19741050 ecr 0,nop,wscale 7], length 0
18:02:23.982663 IP 10.42.4.3.45864 > 10.42.3.4.9090: Flags [S], seq 2793781803, win 29200, options [mss 1460,sackOK,TS val 19741050 ecr 0,nop,wscale 7], length 0
18:02:23.982680 IP 10.42.4.3.45864 > 10.42.3.4.9090: Flags [S], seq 2793781803, win 29200, options [mss 1460,sackOK,TS val 19741050 ecr 0,nop,wscale 7], length 0
[...]
18:02:24.984278 IP 10.42.4.3.45862 > 10.42.3.4.9090: Flags [S], seq 3062027549, win 29200, options [mss 1460,sackOK,TS val 19742052 ecr 0,nop,wscale 7], length 0
18:02:24.984173 IP 10.42.4.3.45864 > 10.42.3.4.9090: Flags [S], seq 2793781803, win 29200, options [mss 1460,sackOK,TS val 19742052 ecr 0,nop,wscale 7], length 0
18:02:24.984291 IP 10.42.4.3.45864 > 10.42.3.4.9090: Flags [S], seq 2793781803, win 29200, options [mss 1460,sackOK,TS val 19742052 ecr 0,nop,wscale 7], length 0
18:02:24.984176 IP 10.42.4.3.45866 > 10.42.3.4.9090: Flags [S], seq 2282303013, win 29200, options [mss 1460,sackOK,TS val 19742052 ecr 0,nop,wscale 7], length 0
18:02:24.984302 IP 10.42.4.3.45866 > 10.42.3.4.9090: Flags [S], seq 2282303013, win 29200, options [mss 1460,sackOK,TS val 19742052 ecr 0,nop,wscale 7], length 0
18:02:24.984180 IP 10.42.4.3.45868 > 10.42.3.4.9090: Flags [S], seq 173986768, win 29200, options [mss 1460,sackOK,TS val 19742052 ecr 0,nop,wscale 7], length 0
18:02:24.984313 IP 10.42.4.3.45868 > 10.42.3.4.9090: Flags [S], seq 173986768, win 29200, options [mss 1460,sackOK,TS val 19742052 ecr 0,nop,wscale 7], length 0
18:02:24.984183 IP 10.42.4.3.45870 > 10.42.3.4.9090: Flags [S], seq 1030721675, win 29200, options [mss 1460,sackOK,TS val 19742052 ecr 0,nop,wscale 7], length 0
```

shell in prometheus-agent proves that prometheus container is able to collect and provide metrics
```
curl "http://localhost:9090/api/v1/query_range?end=2019-03-18T17%3A13%3A24.061195063Z&query=sum%28rate%28container_network_transmit_packets_total%7Bnamespace%3D~%22cattle-prometheus%22%2Cpod_name%3D~%22prometheus-cluster-monitoring-0%22%2C+container_name%21%3D%22%22%7D%5B5m%5D%29%29&start=2019-03-18T16%3A13%3A24.061195063Z&step=60.000"
{"status":"success","data":{"resultType":"matrix","result":[{"metric":{},"values":[[1552925604.061,"9.492592592592592"],[1552925664.061,"9.670370370370371"],[1552925724.061,"9.55925925925926"],[1552925784.061,"8.644444444444446"],[1552925844.061,"9.385185185185186"],[1552925904.061,"9.137037037037038"],[1552925964.061,"9.1"],[1552926024.061,"9.496296296296297"],[1552926084.061,"9.014814814814814"],[1552926144.061,"9.511111111111111"],[1552926204.061,"9.518518518518519"],[1552926264.061,"9.837037037037037"],[1552926324.061,"10.203703703703704"],[1552926384.061,"10.222222222222223"],[1552926444.061,"10.314814814814817"],[1552926504.061,"10.003703703703705"],[1552926564.061,"10.522222222222224"],[1552926624.061,"10.155555555555557"],[1552926684.061,"10.655555555555557"],[1552926744.061,"10.281481481481483"],[1552926804.061,"9.462962962962964"],[1552926864.061,"8.82962962962963"],[1552926924.061,"8.551851851851852"],[1552926984.061,"8.207407407407407"],[1552927044.061,"9.48888888888889"],[1552927104.061,"9.333333333333334"],[1552927164.061,"9.511111111111111"],[1552927224.061,"9.35925925925926"],[1552927284.061,"9.574074074074074"],[1552927344.061,"9.570370370370371"],[1552927404.061,"9.811111111111112"],[1552927464.061,"10.52962962962963"],[1552927524.061,"9.825925925925926"],[1552927584.061,"10.77037037037037"],[1552927644.061,"10.077777777777778"],[1552927704.061,"10.318518518518518"],[1552927764.061,"10.15925925925926"],[1552927824.061,"9.685185185185185"],[1552927884.061,"8.87037037037037"],[1552927944.061,"9.096296296296297"],[1552928004.061,"9.403703703703705"],[1552928064.061,"9.437037037037038"],[1552928124.061,"9.466666666666667"],[1552928184.061,"9.203703703703704"],[1552928244.061,"8.58148148148148"],[1552928304.061,"8.855555555555556"],[1552928364.061,"8.877777777777778"],[1552928424.061,"9.148148148148147"],[1552928484.061,"8.955555555555556"],[1552928544.061,"8.322222222222223"],[1552928604.061,"8.677777777777779"],[1552928664.061,"7.862962962962964"],[1552928724.061,"8.222222222222223"],[1552928784.061,"9.011144485720319"],[1552928844.061,"8.496296296296297"],[1552928904.061,"9.066666666666666"],[1552928964.061,"8.866666666666667"],[1552929024.061,"8.977777777777778"],[1552929084.061,"9.196296296296298"],[1552929144.061,"8.866666666666667"],[1552929204.061,"9.337037037037037"]]}]}}/ 
```

so we are back to the log in for the container prometheus-agent, saying that the proxy is not working
```
INFO[2019-03-18T17:28:40Z] listening on 10.42.3.5:9090, proxying to http://localhost:9090 with ignoring 'remote reader' labels [prometheus,prometheus_replica], only allow maximum 512 connections with 5m0s read timeout .
INFO[2019-03-18T17:28:40Z] Start listening for connections on 10.42.3.5:9090
2019/03/18 17:28:56 http: proxy error: context canceled
2019/03/18 17:28:57 http: proxy error: context canceled
2019/03/18 17:28:59 http: proxy error: context canceled
2019/03/18 17:29:06 http: proxy error: context canceled
2019/03/18 17:29:07 http: proxy error: context canceled
2019/03/18 17:29:16 http: proxy error: context canceled
2019/03/18 17:29:17 http: proxy error: context canceled
```

**Comment by thxCode** [comment]
@jbroq , thank you for all the detail. There is a related issue from go: https://github.com/golang/go/issues/20071, but I need to reproduce this myself and try to fix.

**Comment by jbroq** [comment]
thanks @thxCode
I am really happy to read that.

**Comment by alena1108** [comment]
@jbroq we can't reproduce this issue on 2.2.2-rc12. Could you give this build a try?

**Comment by loganhz** [comment]
`2019/03/18 17:29:16 http: proxy error: context canceled` is a no harmful log
Not sure if you hit https://github.com/rancher/rancher/issues/19243

**Comment by loganhz** [comment]
Please let us know in a comment if you can still reproduce the issue, and we'll reopen it
