### ISSUE TITLE
IPSec in strange state - will not connect

### ISSUE THREAD

**Issue by deitch** [rancher/rancher#2901]
I have two hosts. Network agent is running on both, each has a rancher-managed IP:

* Host agent1, network-agent 10.42.32.205/16, docker IP 172.17.0.1/16
* Host lc-01, network-agent 10.42.182.129/16, docker IP 172.17.0.5/16

I cannot ping from one network agent to the other, i.e. I execute a shell in agent1, then ping 10.42.32.205. It hangs.

With @alena1108's help, I checked iptables rules, they seem to be more or less correct:

agent1:
````
# iptables -L -n
(just some of the output)
Chain DOCKER (1 references)
target     prot opt source               destination
ACCEPT     udp  --  0.0.0.0/0            172.17.0.1           udp dpt:4500
ACCEPT     udp  --  0.0.0.0/0            172.17.0.1           udp dpt:500
ACCEPT     udp  --  0.0.0.0/0            172.17.0.1           udp dpt:4500
ACCEPT     udp  --  0.0.0.0/0            172.17.0.1           udp dpt:500

# iptables -t nat -L
[root@agent1 ~]# iptables -L -t nat -n
Chain PREROUTING (policy ACCEPT)
target     prot opt source               destination
CATTLE_PREROUTING  all  --  0.0.0.0/0            0.0.0.0/0
DOCKER     all  --  0.0.0.0/0            0.0.0.0/0            ADDRTYPE match dst-type LOCAL

Chain INPUT (policy ACCEPT)
target     prot opt source               destination

Chain OUTPUT (policy ACCEPT)
target     prot opt source               destination
DOCKER     all  --  0.0.0.0/0           !127.0.0.0/8          ADDRTYPE match dst-type LOCAL

Chain POSTROUTING (policy ACCEPT)
target     prot opt source               destination
CATTLE_POSTROUTING  all  --  0.0.0.0/0            0.0.0.0/0
MASQUERADE  all  --  172.17.0.0/16        0.0.0.0/0
MASQUERADE  udp  --  172.17.0.1           172.17.0.1           udp dpt:4500
MASQUERADE  udp  --  172.17.0.1           172.17.0.1           udp dpt:500
MASQUERADE  udp  --  172.17.0.1           172.17.0.1           udp dpt:4500
MASQUERADE  udp  --  172.17.0.1           172.17.0.1           udp dpt:500

Chain CATTLE_POSTROUTING (1 references)
target     prot opt source               destination
ACCEPT     all  --  10.42.0.0/16         169.254.169.250
MASQUERADE  tcp  --  10.42.0.0/16        !10.42.0.0/16         masq ports: 1024-65535
MASQUERADE  udp  --  10.42.0.0/16        !10.42.0.0/16         masq ports: 1024-65535
MASQUERADE  all  --  10.42.0.0/16        !10.42.0.0/16
MASQUERADE  tcp  --  172.17.0.0/16        0.0.0.0/0            masq ports: 1024-65535
MASQUERADE  udp  --  172.17.0.0/16        0.0.0.0/0            masq ports: 1024-65535

Chain CATTLE_PREROUTING (1 references)
target     prot opt source               destination
DNAT       udp  --  0.0.0.0/0            0.0.0.0/0            ADDRTYPE match dst-type LOCAL udp dpt:4500 to:10.42.32.205:4500
DNAT       udp  --  0.0.0.0/0            0.0.0.0/0            ADDRTYPE match dst-type LOCAL udp dpt:500 to:10.42.32.205:500

Chain DOCKER (2 references)
target     prot opt source               destination
DNAT       udp  --  0.0.0.0/0            0.0.0.0/0            udp dpt:4500 to:172.17.0.1:4500
DNAT       udp  --  0.0.0.0/0            0.0.0.0/0            udp dpt:500 to:172.17.0.1:500
````

And on lc-01:
````
# iptables -L -n
(just relevant output)
Chain DOCKER (1 references)
target     prot opt source               destination
ACCEPT     udp  --  0.0.0.0/0            172.17.0.15          udp dpt:4500
ACCEPT     udp  --  0.0.0.0/0            172.17.0.15          udp dpt:500

[root@LC-01 ~]# iptables -t nat -L -n
Chain PREROUTING (policy ACCEPT)
target     prot opt source               destination
CATTLE_PREROUTING  all  --  0.0.0.0/0            0.0.0.0/0
PREROUTING_direct  all  --  0.0.0.0/0            0.0.0.0/0
PREROUTING_ZONES_SOURCE  all  --  0.0.0.0/0            0.0.0.0/0
PREROUTING_ZONES  all  --  0.0.0.0/0            0.0.0.0/0
DOCKER     all  --  0.0.0.0/0            0.0.0.0/0            ADDRTYPE match dst-type LOCAL

Chain INPUT (policy ACCEPT)
target     prot opt source               destination

Chain OUTPUT (policy ACCEPT)
target     prot opt source               destination
OUTPUT_direct  all  --  0.0.0.0/0            0.0.0.0/0
DOCKER     all  --  0.0.0.0/0           !127.0.0.0/8          ADDRTYPE match dst-type LOCAL

Chain POSTROUTING (policy ACCEPT)
target     prot opt source               destination
CATTLE_POSTROUTING  all  --  0.0.0.0/0            0.0.0.0/0
MASQUERADE  all  --  172.17.0.0/16        0.0.0.0/0
POSTROUTING_direct  all  --  0.0.0.0/0            0.0.0.0/0
POSTROUTING_ZONES_SOURCE  all  --  0.0.0.0/0            0.0.0.0/0
POSTROUTING_ZONES  all  --  0.0.0.0/0            0.0.0.0/0
MASQUERADE  udp  --  172.17.0.15          172.17.0.15          udp dpt:4500
MASQUERADE  udp  --  172.17.0.15          172.17.0.15          udp dpt:500

Chain CATTLE_POSTROUTING (1 references)
target     prot opt source               destination
ACCEPT     all  --  10.42.0.0/16         169.254.169.250
MASQUERADE  tcp  --  10.42.0.0/16        !10.42.0.0/16         masq ports: 1024-65535
MASQUERADE  udp  --  10.42.0.0/16        !10.42.0.0/16         masq ports: 1024-65535
MASQUERADE  all  --  10.42.0.0/16        !10.42.0.0/16
MASQUERADE  tcp  --  172.17.0.0/16        0.0.0.0/0            masq ports: 1024-65535
MASQUERADE  udp  --  172.17.0.0/16        0.0.0.0/0            masq ports: 1024-65535

Chain CATTLE_PREROUTING (1 references)
target     prot opt source               destination
DNAT       udp  --  0.0.0.0/0            0.0.0.0/0            ADDRTYPE match dst-type LOCAL udp dpt:4500 to:10.42.182.129:4500
DNAT       udp  --  0.0.0.0/0            0.0.0.0/0            ADDRTYPE match dst-type LOCAL udp dpt:500 to:10.42.182.129:500

Chain DOCKER (2 references)
target     prot opt source               destination
DNAT       udp  --  0.0.0.0/0            0.0.0.0/0            udp dpt:4500 to:172.17.0.15:4500
DNAT       udp  --  0.0.0.0/0            0.0.0.0/0            udp dpt:500 to:172.17.0.15:500

Chain OUTPUT_direct (1 references)
target     prot opt source               destination

Chain POSTROUTING_ZONES (1 references)
target     prot opt source               destination
POST_public  all  --  0.0.0.0/0            0.0.0.0/0           [goto]
POST_public  all  --  0.0.0.0/0            0.0.0.0/0           [goto]

Chain POSTROUTING_ZONES_SOURCE (1 references)
target     prot opt source               destination

Chain POSTROUTING_direct (1 references)
target     prot opt source               destination

Chain POST_public (2 references)
target     prot opt source               destination
POST_public_log  all  --  0.0.0.0/0            0.0.0.0/0
POST_public_deny  all  --  0.0.0.0/0            0.0.0.0/0
POST_public_allow  all  --  0.0.0.0/0            0.0.0.0/0

Chain POST_public_allow (1 references)
target     prot opt source               destination

Chain POST_public_deny (1 references)
target     prot opt source               destination

Chain POST_public_log (1 references)
target     prot opt source               destination

Chain PREROUTING_ZONES (1 references)
target     prot opt source               destination
PRE_public  all  --  0.0.0.0/0            0.0.0.0/0           [goto]
PRE_public  all  --  0.0.0.0/0            0.0.0.0/0           [goto]

Chain PREROUTING_ZONES_SOURCE (1 references)
target     prot opt source               destination

Chain PREROUTING_direct (1 references)
target     prot opt source               destination

Chain PRE_public (2 references)
target     prot opt source               destination
PRE_public_log  all  --  0.0.0.0/0            0.0.0.0/0
PRE_public_deny  all  --  0.0.0.0/0            0.0.0.0/0
PRE_public_allow  all  --  0.0.0.0/0            0.0.0.0/0

Chain PRE_public_allow (1 references)
target     prot opt source               destination

Chain PRE_public_deny (1 references)
target     prot opt source               destination

Chain PRE_public_log (1 references)
target     prot opt source               destination
````

Of course, this messes up networking, and along the way the health checks.

**Comment by jwhitcraft** [comment]
I"m seeing the exact same problem recently.

**Comment by deitch** [comment]
@jwhitcraft Thank you. I thought I was all alone in the wilderness here.

**Comment by jwhitcraft** [comment]
I believe this is the same problem on #2944

**Comment by danvanwijk** [comment]
Yeah, feels like the same problem. Is it a persistent issue or are you also seeing this occuring only randomly? Is it always the same hosts or does it occur on more? It seems to be kind of random in our case.

**Comment by deitch** [comment]
It sure looks the same. I have been testing it mostly on a small set of hosts and VMs.

I usually log into the network-agent and try to ping the other, while watching tcp packets.

**Comment by jwhitcraft** [comment]
It's very random on mysetup.  We didn't start seeing this till monday night/tuesday am.  But i hop on all of our hosts and start pinging from host to network-agent on the other hosts to figure out which ones are down.

**Comment by Rucknar** [comment]
Jump on the network container and checkout out the /var/log/racoon.log file, anything in there?

**Comment by deitch** [comment]
I just jumped back in, restarted everything. From network agent on LC-01 `10.42.182.129/16` tried to ping network agent on agent1 `10.42.32.205/16`.

````
root@5815e8f98f6b:/# ping 10.42.32.205
PING 10.42.32.205 (10.42.32.205) 56(84) bytes of data.
^C
--- 10.42.32.205 ping statistics ---
3 packets transmitted, 0 received, 100% packet loss, time 1999ms
````

Nothing getting through. 

`/var/log/racoon.log` looks like the following (last lines keep repeating, so cut them off):

````
root@5815e8f98f6b:/var/log# cat racoon.log
2015-12-14 09:12:01: INFO: @(#)ipsec-tools 0.8.0 (http://ipsec-tools.sourceforge.net)
2015-12-14 09:12:01: INFO: @(#)This product linked OpenSSL 1.0.1f 6 Jan 2014 (http://www.openssl.org/)
2015-12-14 09:12:01: INFO: Reading configuration from "/etc/racoon/racoon.conf"
2015-12-14 14:53:52: [10.0.4.44] ERROR: phase2 negotiation failed due to time up waiting for phase1. ESP 10.0.4.44[0]->172.17.0.31[0]
2015-12-14 14:54:11: ERROR: phase1 negotiation failed due to time up. 9b87c1f2636ef466:0000000000000000
2015-12-14 14:54:25: [10.0.4.44] ERROR: phase2 negotiation failed due to time up waiting for phase1. ESP 10.0.4.44[0]->172.17.0.31[0]
2015-12-14 14:54:57: [10.0.4.44] ERROR: phase2 negotiation failed due to time up waiting for phase1. ESP 10.0.4.44[0]->172.17.0.31[0]
2015-12-14 14:55:15: ERROR: phase1 negotiation failed due to time up. 9b261b2bc280e69b:0000000000000000
2015-12-14 14:55:27: [10.0.4.44] ERROR: phase2 negotiation failed due to time up waiting for phase1. ESP 10.0.4.44[0]->172.17.0.31[0]
2015-12-14 14:55:57: [10.0.4.44] ERROR: phase2 negotiation failed due to time up waiting for phase1. ESP 10.0.4.44[0]->172.17.0.31[0]
2015-12-14 14:56:16: ERROR: phase1 negotiation failed due to time up. 93169c020d9b5961:0000000000000000
2015-12-14 14:56:27: [10.0.4.44] ERROR: phase2 negotiation failed due to time up waiting for phase1. ESP 10.0.4.44[0]->172.17.0.31[0]
2015-12-14 14:56:57: [10.0.4.44] ERROR: phase2 negotiation failed due to time up waiting for phase1. ESP 10.0.4.44[0]->172.17.0.31[0]
2015-12-14 14:57:16: ERROR: phase1 negotiation failed due to time up. 397553854c35aab6:0000000000000000
2015-12-14 15:35:36: [10.0.4.44] ERROR: phase2 negotiation failed due to time up waiting for phase1. ESP 10.0.4.44[0]->172.17.0.31[0]
2015-12-14 15:35:45: ERROR: no policy found for spid:4841.
2015-12-14 15:35:45: ERROR: failed to get ID.
2015-12-14 15:35:45: ERROR: failed to start post getspi.
````

**Comment by Rucknar** [comment]
Can the hosts ping each other directly?

**Comment by deitch** [comment]
Most definitely. And get to port 22 as well:

From LC-01
````
[root@LC-01 ~]# ping agent1
PING agent1.pfs.co.il (10.0.4.44) 56(84) bytes of data.
64 bytes from agent1.pfs.co.il (10.0.4.44): icmp_seq=1 ttl=64 time=0.279 ms
64 bytes from agent1.pfs.co.il (10.0.4.44): icmp_seq=2 ttl=64 time=0.448 ms
^C
--- agent1.pfs.co.il ping statistics ---
2 packets transmitted, 2 received, 0% packet loss, time 1001ms
rtt min/avg/max/mdev = 0.279/0.363/0.448/0.086 ms
[root@LC-01 ~]# telnet agent1 22
Trying 10.0.4.44...
Connected to agent1.
Escape character is '^]'.
SSH-2.0-OpenSSH_6.6.1
````

From agent1:

````
[root@agent1 ~]# ping LC-01
PING LC-01.pfs.co.il (10.0.2.71) 56(84) bytes of data.
64 bytes from lc-01.pfs.co.il (10.0.2.71): icmp_seq=1 ttl=64 time=0.600 ms
64 bytes from lc-01.pfs.co.il (10.0.2.71): icmp_seq=2 ttl=64 time=0.588 ms
64 bytes from lc-01.pfs.co.il (10.0.2.71): icmp_seq=3 ttl=64 time=0.612 ms
^C
--- LC-01.pfs.co.il ping statistics ---
3 packets transmitted, 3 received, 0% packet loss, time 2003ms
rtt min/avg/max/mdev = 0.588/0.600/0.612/0.009 ms
[root@agent1 ~]# telnet LC-01 22
Trying 10.0.2.71...
Connected to LC-01.
Escape character is '^]'.
SSH-2.0-OpenSSH_6.6.1
````

**Comment by Rucknar** [comment]
Is there any firewall on the host or between the hosts? I believe racoon requires 500 UDP to setup a tunnel.

**Comment by deitch** [comment]
Yes, firewalld is set up. Funnily enough, the iptables rules look better on LC-01 with ACCEPT for 500/4500, but not on agent1. tcpdump shows:

````
[root@agent1 ~]# tcpdump port 500 or 4500
tcpdump: verbose output suppressed, use -v or -vv for full protocol decode
listening on eth0, link-type EN10MB (Ethernet), capture size 65535 bytes
18:32:02.219017 IP lc-01.pfs.co.il.1024 > agent1.pfs.co.il.isakmp: isakmp: phase 1 I agg
18:32:12.220481 IP lc-01.pfs.co.il.1024 > agent1.pfs.co.il.isakmp: isakmp: phase 1 I agg
18:32:22.221495 IP lc-01.pfs.co.il.1024 > agent1.pfs.co.il.isakmp: isakmp: phase 1 I agg
18:32:32.222596 IP lc-01.pfs.co.il.1024 > agent1.pfs.co.il.isakmp: isakmp: phase 1 I agg
18:32:42.223475 IP lc-01.pfs.co.il.1024 > agent1.pfs.co.il.isakmp: isakmp: phase 1 I agg
18:33:06.254988 IP lc-01.pfs.co.il.1024 > agent1.pfs.co.il.isakmp: isakmp: phase 1 I agg
````

1. Shouldn't the network-agent itself set up the necessary iptables rules? 
2. How can I force the network-agent to reinitialize the iptables rules?
3. Even when set up correctly, it never worked. See the original posting here.

**Comment by Rucknar** [comment]
Not too sure on the process to reinitialize them, @alena1108 might be able to offer some advice here.
Like you say, they should be automatically configured and usually are. What OS are you using for LC-01 and agent1?

**Comment by deitch** [comment]
CentOS 7

**Comment by deitch** [comment]
Hmm, now that is strange. It looks like when firewalld is restarted on one of the hosts, the DOCKER chain just disappears.

**Comment by janeczku** [comment]
I now start seeing the same problem on some Ubuntu 14.04 hosts deployed on DigitalOcean.

Ping between hosts: OK
Ping between network agents:
```BASH
PING 10.42.202.93 (10.42.202.93) 56(84) bytes of data.
From 10.42.5.56 icmp_seq=1 Destination Host Unreachable
```
Iptables rules look good. Ports are open:

> nc -vzu 46.xxx.xxx.xxx 500

`Connection to 46.xxx.xxx.xxx port 500 [udp/isakmp] succeeded!`

> cat /var/log/racoon.log

```TEXT
2015-12-28 23:55:29: INFO: @(#)ipsec-tools 0.8.0 (http://ipsec-tools.sourceforge.net)
2015-12-28 23:55:29: INFO: @(#)This product linked OpenSSL 1.0.1f 6 Jan 2014 (http://www.openssl.org/)
2015-12-28 23:55:29: INFO: Reading configuration from "/etc/racoon/racoon.conf"
2015-12-29 13:28:29: WARNING: no outbound policy found: 10.42.5.56/32[0] 10.42.0.0/16[0] proto=any dir=out
```

/cc @ibuildthecloud

**Comment by ibuildthecloud** [comment]
By tomorrow there will (or should) be a RC build in which we've swapped out the IPSec IKE to Charon.  This is in an effort to address these bugs.  Can't guarantee it will fix everything or not cause new issues, but it allows us to actually address some of these bugs.  Our current implementation uses racoon which kind of left us with our hands tied in terms of fixing things.

**Comment by deitch** [comment]
So you are swapping out the IPSec engine? Hope it works. This really has been painful.

**Comment by danvanwijk** [comment]
Holding my thumbs here that this will fix our issue as well. Looking forward to the release!

**Comment by janeczku** [comment]
:thumbsup:

**Comment by will-chan** [comment]
#2944

**Comment by sangeethah** [comment]
With rancher-server version - v0.56.0 , we updating ipsec to use charon instead of racoon.
If you still see issues with this version, please log a new issue to track it.

**Comment by deitch** [comment]
We will, thanks.

**Comment by deitch** [comment]
I still am seeing an issue.

Here is the config:

Host1 containers and rancher-managed IP: network-agent 10.42.129.113, svcA 10.42.124.118, svcB 10.42.112.151

Host2 containers and rancher-managed IP: network-agent 10.42.225.138, svcC 10.42.89.103

Each network-agent can ping the IPs on its own host. Network-agent cannot ping IPs on the other host, not even the network-agent.

As before, the iptables rules look clean:

````
# host1
Chain DOCKER (1 references)
target     prot opt source               destination
ACCEPT     udp  --  0.0.0.0/0            172.17.0.1           udp dpt:4500
ACCEPT     udp  --  0.0.0.0/0            172.17.0.1           udp dpt:500

$ docker exec -it 47a86b1e78d5 ip a
47: eth0: <BROADCAST,MULTICAST,UP,LOWER_UP> mtu 1500 qdisc noqueue state UP group default
    link/ether 02:28:15:d6:8e:58 brd ff:ff:ff:ff:ff:ff
    inet 172.17.0.1/16 scope global eth0
       valid_lft forever preferred_lft forever
    inet 10.42.225.138/16 scope global eth0
       valid_lft forever preferred_lft forever
    inet 169.254.169.250/32 scope global eth0
       valid_lft forever preferred_lft forever
    inet6 fe80::28:15ff:fed6:8e58/64 scope link
       valid_lft forever preferred_lft forever
````

Same on the other host, although there it is 172.17.0.2. So all is clean there. 

Still, the packets do not arrive. 

When I ping from host1 to host2 and listen with tcpdump, *nothing* arrives:

````
# host1:
root@cc8a4455540f:/# ping 10.42.225.138
PING 10.42.225.138 (10.42.225.138) 56(84) bytes of data.

# host2:
$ tcpdump port 500 or 4500
tcpdump: verbose output suppressed, use -v or -vv for full protocol decode
listening on eth0, link-type EN10MB (Ethernet), capture size 65535 bytes
````

Help?

**Comment by sangeethah** [comment]
@deitch , what is the host OS ? If it is CoreOS we have this known issue with v0.56.0  - #3416 .
If not coreOS , Is this is a fresh install or upgraded set up ? Whats is the host OS ? If it is an upgraded setup , you may encounter connectivity issues which can be corrected by restarting network agents on the hosts. Restarting Network Agent may result in network agent stuck in "Starting" state due to #1406 . 
If you hit this issue , rebooting hosts should fix the problem.

**Comment by deitch** [comment]
CentOS 7 all the way through (Rancher server, both agent hosts). Upgraded setup.

I will try restarting network agents, though.

**Comment by deitch** [comment]
Restarted network agents. No luck. It started cleanly, but still has no connectivity outside of the host. It cannot the Rancher-managed IP on the other host, or, for that matter, the other host itself. But it can ping any IP, including the host, on its own host.

Rancher version is 0.56.0, clicking on network-agent container gives version rancher/agent-instance:v0.6.0. 

Is the version correct? What further information can I use to debug?

**Comment by danvanwijk** [comment]
For reference: I've upgraded to 0.56.1 now and so far things appear to be working. I had to restart some of the hosts (didn't try just restarting the agent) to get connectivity to work. Will let you know if there are any problems again. Thanks!

**Comment by silviupanaite** [comment]
Component	Version
Rancher	v0.56.1
Cattle	v0.141.1
User Interface	v0.86.0
Rancher Compose	v0.7.1

3 hosts:

- 2 restarted network agents / host
- 1 idle

- Host 1 : ubuntu (restarted agents/host)
- Host 2 : debian (restarted agents/host)

- Serv 1(host1) 
- Serv 2(host2)

I'm trying to ping Serv2 from Serv1
ING tst.rancher.internal (10.42.147.169): 56 data bytes
^C--- tst.rancher.internal ping statistics ---
26 packets transmitted, 0 packets received, 100% packet loss


tail -f /var/log/rancher-net.log
time="2016-02-01T12:28:19Z" level=info msg=Reconfiguring 
time="2016-02-01T12:28:24Z" level=info msg="Deleting unknown SPI 0: netlink.XfrmState{Dst:net.IP{0x0, 0x0, 0x0, 0x0, 0x0, 0x0, 0x0, 0x0, 0x0, 0x0, 0xff, 0xff, 0x77, 0x51, 0x71, 0xdb}, Src:net.IP{0x0, 0x0, 0x0, 0x0, 0x0, 0x0, 0x0, 0x0, 0x0, 0x0, 0xff, 0xff, 0xac, 0x11, 0x0, 0x2}, Proto:0x32, Mode:0x1, Spi:0, Reqid:1234, ReplayWindow:0, Auth:(*netlink.XfrmStateAlgo)(nil), Crypt:(*netlink.XfrmStateAlgo)(nil), Encap:(*netlink.XfrmStateEncap)(nil)}" 
time="2016-02-01T12:28:24Z" level=info msg="Deleting unknown SPI 0: netlink.XfrmState{Dst:net.IP{0x0, 0x0, 0x0, 0x0, 0x0, 0x0, 0x0, 0x0, 0x0, 0x0, 0xff, 0xff, 0xb0, 0x1f, 0x75, 0x55}, Src:net.IP{0x0, 0x0, 0x0, 0x0, 0x0, 0x0, 0x0, 0x0, 0x0, 0x0, 0xff, 0xff, 0xac, 0x11, 0x0, 0x2}, Proto:0x32, Mode:0x1, Spi:0, Reqid:1234, ReplayWindow:0, Auth:(*netlink.XfrmStateAlgo)(nil), Crypt:(*netlink.XfrmStateAlgo)(nil), Encap:(*netlink.XfrmStateEncap)(nil)}" 
time="2016-02-01T12:28:29Z" level=info msg="Unknown SPIs: map[string]int{\"0\":1}, Conns: []goStrongswanVici.VpnConnInfo{}" 
time="2016-02-01T12:28:34Z" level=info msg="Unknown SPIs: map[string]int{\"0\":2}, Conns: []goStrongswanVici.VpnConnInfo{}" 
time="2016-02-01T12:28:39Z" level=info msg="Unknown SPIs: map[string]int{\"0\":3}, Conns: []goStrongswanVici.VpnConnInfo{}" 
time="2016-02-01T12:28:44Z" level=info msg="Unknown SPIs: map[string]int{\"0\":4}, Conns: []goStrongswanVici.VpnConnInfo{}" 
time="2016-02-01T12:28:49Z" level=info msg="Deleting unknown SPI 0: netlink.XfrmState{Dst:net.IP{0x0, 0x0, 0x0, 0x0, 0x0, 0x0, 0x0, 0x0, 0x0, 0x0, 0xff, 0xff, 0x77, 0x51, 0x71, 0xdb}, Src:net.IP{0x0, 0x0, 0x0, 0x0, 0x0, 0x0, 0x0, 0x0, 0x0, 0x0, 0xff, 0xff, 0xac, 0x11, 0x0, 0x2}, Proto:0x32, Mode:0x1, Spi:0, Reqid:1234, ReplayWindow:0, Auth:(*netlink.XfrmStateAlgo)(nil), Crypt:(*netlink.XfrmStateAlgo)(nil), Encap:(*netlink.XfrmStateEncap)(nil)}" 
time="2016-02-01T12:28:49Z" level=info msg="Deleting unknown SPI 0: netlink.XfrmState{Dst:net.IP{0x0, 0x0, 0x0, 0x0, 0x0, 0x0, 0x0, 0x0, 0x0, 0x0, 0xff, 0xff, 0xb0, 0x1f, 0x75, 0x55}, Src:net.IP{0x0, 0x0, 0x0, 0x0, 0x0, 0x0, 0x0, 0x0, 0x0, 0x0, 0xff, 0xff, 0xac, 0x11, 0x0, 0x2}, Proto:0x32, Mode:0x1, Spi:0, Reqid:1234, ReplayWindow:0, Auth:(*netlink.XfrmStateAlgo)(nil), Crypt:(*netlink.XfrmStateAlgo)(nil), Encap:(*netlink.XfrmStateEncap)(nil)}" 
time="2016-02-01T12:28:54Z" level=info msg="Unknown SPIs: map[string]int{\"0\":1}, Conns: []goStrongswanVici.VpnConnInfo{}" 
time="2016-02-01T12:28:59Z" level=info msg="Unknown SPIs: map[string]int{\"0\":2}, Conns: []goStrongswanVici.VpnConnInfo{}"

**Comment by deniseschannon** [comment]
@deitch @silviupanaite

**Comment by deniseschannon** [comment]
Sorry, hit enter too quickly.

After you've attempted to restart the network agents as well as restart the hosts, can you try these steps?

Exec into the network agent and do a ps-eaf | grep rancher-net. You should get something like below. Ideally, for ubuntu, centos, rancheros, it should have --gcm=true and for coreos, it should have --gcm=false. 

If rancher-net doesn't even run, you might need to try to delete the network agent so that Rancher will create a new one.

**Comment by deitch** [comment]
@deniseschannon from one of them:

````
root@cc8a4455540f:/# ps -ef | grep rancher-net | grep -v grep
root      1187     1  0 Jan26 ?        00:06:00 /var/lib/cattle/bin/rancher-net --log /var/log/rancher-net.log -f /var/lib/cattle/etc/cattle/ipsec/config.json -c /var/lib/cattle/etc/cattle/ipsec -i 172.17.0.2/16 --pid-file /var/run/rancher-net.pid
````

And the other

````
root@47a86b1e78d5:/# ps -ef | grep rancher-net | grep -v grep
root      1534     1  0 Jan26 ?        00:05:39 /var/lib/cattle/bin/rancher-net --log /var/log/rancher-net.log -f /var/lib/cattle/etc/cattle/ipsec/config.json -c /var/lib/cattle/etc/cattle/ipsec -i 172.17.0.1/16 --pid-file /var/run/rancher-net.pid
````

**Comment by deniseschannon** [comment]
@deitch I'm not sure why `--gcm` isn't showing up. Can you try removing the network agent and letting Rancher create a new one?

**Comment by deitch** [comment]
Just delete both from the host view, waiting for the service to restart them.

**Comment by deitch** [comment]
No change. I deleted each one, let rancher restart, same ps output.

**Comment by deniseschannon** [comment]
Unfortunately, I'm out of ideas on how else to troubleshoot it. I haven't tried CentOS 7 yet, but can probably set something up later this week.

**Comment by deitch** [comment]
Heh, I certainly don't! Give me some ideas, we are happy to get more debug info.

**Comment by will-chan** [comment]
@ibuildthecloud can you take a look into this if this is related to your recent network changes?

**Comment by deitch** [comment]
While we are on it... ever since I deleted the network-agent (forcing rancher to recreate them), as you suggested @deniseschannon , I cannot "Execute Shell" on any container on any host. I just get a blank white window. 

I could open a new issue, but is this related?

**Comment by deniseschannon** [comment]
I don't think that should be related. Can you check that Docker is still working on your hosts? A simple `docker ps` on the host would help.

**Comment by deitch** [comment]
It most certainly is! I ran lots of `docker exec` and `docker logs` commands manually on them.

**Comment by deniseschannon** [comment]
When you try to execute your shell, is there any notes in the bottom right of the blank white screen? Anything in your Rancher server logs about websocket issues?

**Comment by deniseschannon** [comment]
@deitch Also, I just read about how you haven't upgraded to v0.56.1. There was one other networking bug that was fixed (regarding `--gcm`) so could you try upgrading to see if that helps?

**Comment by silviupanaite** [comment]
host 1 : ubuntu

`
root      1167     1  0 Feb01 ?        00:01:34 /var/lib/cattle/bin/rancher-net 
--log /var/log/rancher-net.log -f /var/lib/cattle/etc/cattle/ipsec/config.json -
c /var/lib/cattle/etc/cattle/ipsec -i 172.17.0.2/16 --pid-file /var/run/rancher-
net.pid --gcm=false  
`
host 2 : debian
'root      1219     1  0 Feb01 ?        00:00:36 /var/lib/cattle/bin/rancher-net 
--log /var/log/rancher-net.log -f /var/lib/cattle/etc/cattle/ipsec/config.json -
c /var/lib/cattle/etc/cattle/ipsec -i 172.17.0.2/16 --pid-file /var/run/rancher-
net.pid --gcm=false                                                             
'

**Comment by deitch** [comment]
@deniseschannon just upgraded to 0.56.1. Also deleted the network-agent containers, to force rancher to restart them with the latest.

**Comment by deitch** [comment]
And I wait and wait. Rancher doesn't seem to want to restart the network-agent containers.

**Comment by deitch** [comment]
Nope. The network-agent is not restarting on either host.

**Comment by Rucknar** [comment]
@deitch On my setup rancher did this automatically.Might be worth trying to start a container with a networking requirement on one of those hosts to prompt the creation of a network agent

**Comment by deitch** [comment]
That did it, but only if network is managed.

**Comment by deitch** [comment]
So now I have the `gcm=false`:

````
root      1433  0.5  0.0 124692  4812 ?        Sl   10:36   0:00 /var/lib/cattle/bin/rancher-net --log /var/log/rancher-net.log -f /var/lib/cattle/etc/cattle/ipsec/config.json -c /var/lib/cattle/etc/cattle/ipsec -i 172.17.0.1/16 --pid-file /var/run/rancher-net.pid --gcm=false
````

True on both hosts.

But... still no ipsec tunnel communication!

**Comment by Rucknar** [comment]
From the rancher network container, run : `swanctl  --list-sas` and `swanctl --list-conns`that should list the VPN tunnels. Paste the output here.

**Comment by deitch** [comment]
Sure, thanks:

````
root@a4ffbbf69a6a:/# swanctl --list-sas
conn-10.0.2.105: #2, CONNECTING, IKEv2, 4235168141fd2aa1:0000000000000000
  local  '%any' @ 172.17.0.1
  remote '%any' @ 10.0.2.105
  active:  IKE_VENDOR IKE_INIT IKE_NATD IKE_CERT_PRE IKE_AUTH IKE_CERT_POST IKE_CONFIG CHILD_CREATE IKE_AUTH_LIFETIME IKE_MOBIKE
root@a4ffbbf69a6a:/# swanctl --list-conns
conn-10.0.2.105:
  local:  %any
  remote: 10.0.2.105
  local pre-shared key authentication:
  remote pre-shared key authentication:
  child-10.0.2.105: TUNNEL
    local:  0.0.0.0/0
    remote: 0.0.0.0/0
````

**Comment by Rucknar** [comment]
Yea that suggests it's not been able to establish an IPSEC tunnel between the hosts. 
For instance i see output such as:
`conn-10.194.97.48: #120, ESTABLISHED, IKEv2, 39d4f1b006f5e407:516a9746f8f68b60`
I guess going back to basics, it's worth checking networking connectivity between the hosts, i expect you've already done that to death though. 

I've not had an issue so i can't vouch for the following commands, might be worth a look though:

You could try initiate the connection yourself:
`--list-conns` (to get the name) and then `--initiate name`

Also, looks like you might be able to do a soft reload of the daemon with:
`ipsec restart`

**Comment by deitch** [comment]
Indeed, we have ("to death" is right :-) ).

I see no traffic whatsoever coming to port 500 or 4500 on either host.

Interestingly, looking at the output of `list-conns` above, I see:

````
conn-10.0.2.105:
  local:  %any
  remote: 10.0.2.105
  local pre-shared key authentication:
  remote pre-shared key authentication:
  child-10.0.2.105: TUNNEL
    local:  0.0.0.0/0
    remote: 0.0.0.0/0
````

I have no idea where this 10.0.2.105 came from. It is not the IP address of the other host; that is 10.0.2.240, although if I look at the host config on the rancher UI, it lists it as 10.0.2.105. That might have an impact. 

When I run the same `swanctl`l on the other host (the one that is .2.240 but for some reason the first host thinks is .2.105):

````
root@3d045c2fad26:/# swanctl --list-sas
root@3d045c2fad26:/# swanctl --list-conns
conn-10.0.2.36:
  local:  %any
  remote: 10.0.2.36
  local pre-shared key authentication:
  remote pre-shared key authentication:
  child-10.0.2.36: TUNNEL
    local:  0.0.0.0/0
    remote: 0.0.0.0/0
````

Well, at least it has the remote IP correct!

**Comment by Rucknar** [comment]
Do your hosts have multiple IP addresses? If so, i wonder if rancher is using the wrong one to establish that connection between hosts?

**Comment by Rucknar** [comment]
@deitch http://docs.rancher.com/rancher/faqs/hosts/ `HOW DOES THE HOST DETERMINE IP ADDRESS AND HOW CAN I CHANGE IT?` section might have a few answers.

**Comment by deitch** [comment]
Nope, only one NIC in this case.

**Comment by Rucknar** [comment]
Okay, well somehow it's got the wrong record for the IP of the host it's attempted a connection to. 
Grabbing at straws but could the host your registering of existed on that address before?

**Comment by deitch** [comment]
Ha! I am sure it could, I have no idea. What should I do at this point?

**Comment by Rucknar** [comment]
Once the guys in the states come online i suspect they might be able to give you a DB query to verify the potential issue with the IP change. Out of interest, are the hosts on DHCP?

**Comment by silviupanaite** [comment]
Host 1: ubuntu
Host 2: debian
Host 3: ubuntu

I tried the 'swanctl --list-sas' and noticed that on Host1 have me an lib error and decided to purge the network instance from the ui for all 3 hosts ( i have done this from the server side a day earlier for Host 1 and Host3)

on debian the swanctl --list-sas outputs 
```
connecting to 'unix:///var/run/charon.vici' failed: No such file or directory   
Error: connecting to 'default' URI failed: No such file or directory   

```
but now from host1 to host3 

```
root@c2f8be77a4d3:/# ping cs                                                    
PING cs.rancher.internal (10.42.218.239): 56 data bytes                         
64 bytes from 10.42.218.239: icmp_seq=0 ttl=62 time=0.882 ms                    
92 bytes from 10.42.175.47: Redirect Host                                       
64 bytes from 10.42.218.239: icmp_seq=1 ttl=62 time=2.962 ms                    
92 bytes from 10.42.175.47: Redirect Host                                       
64 bytes from 10.42.218.239: icmp_seq=2 ttl=62 time=1.696 ms                    
92 bytes from 10.42.175.47: Redirect Host                                       
64 bytes from 10.42.218.239: icmp_seq=3 ttl=62 time=2.053 ms                    
92 bytes from 10.42.175.47: Redirect Host                                       
64 bytes from 10.42.218.239: icmp_seq=4 ttl=62 time=1.996 ms                    
92 bytes from 10.42.175.47: Redirect Host                                       
64 bytes from 10.42.218.239: icmp_seq=5 ttl=62 time=2.152 ms                    
64 bytes from 10.42.218.239: icmp_seq=6 ttl=62 time=0.646 ms                    
^C--- cs.rancher.internal ping statistics ---                                   
7 packets transmitted, 7 packets received, 0% packet loss                       
round-trip min/avg/max/stddev = 0.646/1.770/2.962/0.732 ms  
```

Just to be sure it's noted, after purging I created a new container demo and made sure that the networking was on managed (clicked the network tab).

**Comment by deitch** [comment]
>Once the guys in the states come online i suspect they might be able to give you a DB query to verify the potential issue with the IP change. 

@Rucknar that's what I am hoping.

> Out of interest, are the hosts on DHCP?

Actually, I think they might be. Why?

**Comment by deniseschannon** [comment]
@deitch 
Try to rerun the rancher agent command and force setting the -e CATTLE_AGENT_IP to the actual host IP. Then try adding another container to reset networking.

I am on my phone but if the IP on the UI is different than the IP on the host, cross host communication won't work.

@silviupanaite I have yet to test Debian in a set up so will try to see what I can test  to see if I can reproduce the networking issue. But glad to hear your Ubuntu to Ubuntu hosts are working.

**Comment by deitch** [comment]
Won't that lose everything running on the host, disconnect it from Rancher, stop services, etc.? Or is it a clean action?

**Comment by deniseschannon** [comment]
@deitch Yes, you should be able to run the command again with the `-e CATTLE_AGENT_IP=<correctIP>` and all your services will still be running. I confirmed with some other people as well.

**Comment by deniseschannon** [comment]
@silviupanaite I just noticed that your `--gcm` value was false, but it should be `--gcm=true`. Have you tried deleting the network agent so Rancher causes a new one to start and will start a new one with the correct flag?

**Comment by deitch** [comment]
@deniseschannon that leads to an interesting question. What *does* happen if a host IP changes? I could see this as common in a cloud environment (digitalocean, aws, etc.). I launch my rancher server and 10 VM instances, each has a dynamic IP. When it starts up, I register it with the rancher server. At some point, the VM goes away and comes back, this time with a new IP. Does it know/register? 

Or is the assumption that an IP remain fixed, and if it goes away and comes back with a different IP, then it is a different host? And what does that do to my list of hosts in "Infrastructure" in the rancher server?

**Comment by vincent99** [comment]
While obviously the largest, AWS is the *only* cloud where dynamic IPs are a default (but optional, use elastic IPs) behavior.  VMs at DigitalOcean, Google, Azure, RackSpace, or anywhere else you can name are assigned static IPs (possibly via DHCP, but irrelevant) because people want to create DNS entries that point at them.

**Comment by deitch** [comment]
True for external facing hosts. But for ones that do not expose external services, IPs do not need or have fixed DNS entries. Actually, even Rancher follows that philosophy, with containers that have constantly changing IPs, but with service discovery and load balancers.

So how does Rancher deal with dynamically adding/changing hosts? Does it have a facility for it, or is the assumption that containers are dynamic and hosts more static?

**Comment by deniseschannon** [comment]
@deitch We have an issue out there for the use case of the changing IP. Currently, Rancher doesn't automatically handle the changing hosts. The current assumption is that the containers are dynamic, but hosts are static. 
https://github.com/rancher/rancher/issues/388

**Comment by deitch** [comment]
Got it. So we have no way of knowing with this set of hosts if the issue is the dynamic address issue, or that is masking something else entirely.
