### ISSUE TITLE
Rancher iptables routing problem (Wrong interface chosen)

### ISSUE THREAD

**Issue by mirkomikulic** [rancher/rancher#16548]
**What kind of request is this (question/bug/enhancement/feature request):**
question / bug

**Steps to reproduce (least amount of steps as possible):**
We have 3 master servers. Each has two interfaces, eth0 (private, bridged) and eth1 (public, NAT). 
Those master servers are split between two hosts. The eth1 address can be reached by if they run on the same host, but not if they're running cross-host. The private interface can be reached cross-host.

The masters are started like this:

docker run -d --privileged --restart=unless-stopped --net=host -v /etc/kubernetes:/etc/kubernetes -v /var/run:/var/run rancher/rancher-agent:v2.1.1 --server https://10.3.1.1 --token *token* --ca-checksum *checksum* --address *eth0-address*  --internal-address *eth0-address* --etcd --controlplane

Worker servers have the same config: eth0 (private, bridged) and eth1 (public, NAT). 
We're starting them like this:

docker run -d --privileged --restart=unless-stopped --net=host -v /etc/kubernetes:/etc/kubernetes -v /var/run:/var/run rancher/rancher-agent:v2.1.1 --server https://10.3.1.1 --token *token* --ca-checksum *checksum* --address  *eth0-address* --internal-address  *eth0-address* --worker

**Result:**
Running curl https://10.43.0.1 on any of the worker nodes works 2 our of 3 times (or 1 out of 3 times). The other time it fails with  No route to host. As such, it seems rancher is using the public interface for communication although it should only use the private ones. 

We verified that via tcpdump.
```
13:02:58.953933 IP 192.168.0.8.43404 > 192.168.0.4.6443: Flags [P.], seq 715:757, ack 103837, win 1858, options 
13:04:56.085555 IP 10.3.1.4.6443 > 10.3.1.7.58674: Flags [P.], seq 13991:14488, ack 85, win 287, options 
````
As you can see, communication happens on both 192.168 (NAT) and 10.3.1 (private), despite never having configured eth1 anywhere.
So, if they're on the same host they can communicate, otherwise they fail. 

We've also added the following options to make sure flannel only uses eth0:
```
network: 
  flannel_network_provider: 
    iface: "eth0"
```
We've confirmed flannel is showing the right interface & IP address in docker logs.

How can we make sure they only ever use the private interface for all communication? 

**Other details that may be helpful:**

**Environment information**
- Rancher version (`rancher/rancher`/`rancher/server` image tag or shown bottom left in the UI):

Rancher | v2.1.1
-- | --
User Interface | v2.1.4
Helm | v2.10.0-rancher5
Machine | v0.15.0-rancher1-1

- Installation option (single install/HA):
HA (3 masters & etcd). Rancher master is single installated.

**Cluster information**
- Cluster type (Hosted/Infrastructure Provider/Custom/Imported):
Custom
- Machine type (cloud/VM/metal) and specifications (CPU/memory):
KVM VM (4 CPUs, 16 Gi RAM). Ubuntu 16.04, Docker 17.03.3-ce
- Kubernetes version (use `kubectl version`):
```
v1.11.3-rancher1-1
```

- Docker (use `docker info`):

```
Containers: 13
 Running: 10
 Paused: 0
 Stopped: 3
Images: 13
Server Version: 17.03.3-ce
Storage Driver: aufs
 Root Dir: /var/lib/docker/aufs
 Backing Filesystem: extfs
 Dirs: 105
 Dirperm1 Supported: true
Logging Driver: json-file
Cgroup Driver: cgroupfs
Plugins:
 Volume: local
 Network: bridge host macvlan null overlay
Swarm: inactive
Runtimes: runc
Default Runtime: runc
Init Binary: docker-init
containerd version: 6c463891b1ad274d505ae3bb738e530d1df2b3c7
runc version: 54296cf40ad8143b62dbcaa1d90e520a2136ddfe
init version: 949e6fa
Security Options:
 apparmor
 seccomp
  Profile: default
Kernel Version: 4.4.0-137-generic
Operating System: Ubuntu 16.04.5 LTS
OSType: linux
Architecture: x86_64
CPUs: 4
Total Memory: 11.73 GiB
Name: worker-audienzz-6
ID: O5MW:5FFW:K5TU:W7AJ:Z6G3:SWFA:WCAA:JVYV:RWWV:KFQS:SMOB:E72C
Docker Root Dir: /var/lib/docker
Debug Mode (client): false
Debug Mode (server): false
Registry: https://index.docker.io/v1/
Experimental: false
Insecure Registries:
 127.0.0.0/8
Live Restore Enabled: false

WARNING: No swap limit support
```

Here's the worker nodes routing table:
```
Kernel IP routing table
Destination     Gateway         Genmask         Flags Metric Ref    Use Iface
0.0.0.0         192.168.0.1     0.0.0.0         UG    0      0        0 eth1
10.3.0.0        0.0.0.0         255.255.252.0   U     0      0        0 eth0
10.42.0.0       10.42.0.0       255.255.255.0   UG    0      0        0 flannel.1
10.42.1.0       10.42.1.0       255.255.255.0   UG    0      0        0 flannel.1
10.42.2.0       10.42.2.0       255.255.255.0   UG    0      0        0 flannel.1
10.42.3.0       0.0.0.0         255.255.255.0   U     0      0        0 cni0
10.42.4.0       10.42.4.0       255.255.255.0   UG    0      0        0 flannel.1
10.42.5.0       10.42.5.0       255.255.255.0   UG    0      0        0 flannel.1
172.17.0.0      0.0.0.0         255.255.0.0     U     0      0        0 docker0
192.168.0.0     0.0.0.0         255.255.255.0   U     0      0        0 eth1
```

**Comment by xorpierre** [comment]
I am working with Mirko on this issue.
Here a confirmation via tcpdump after running: curl -v https://10.43.0.1:443/api/v1/pods -k
The answer comes from Master 192.168.0.4 via eth1 (NAT).
```
14:23:52.502574 IP 192.168.0.8.47826 > 192.168.0.4.6443: Flags [S], seq 2088431775, win 28200, options [mss 1410,sackOK,TS val 1314340 ecr 0,nop,wscale 7], length 0
E..<..@.@..............+|z........n(...........
...$........
14:23:52.502934 IP 192.168.0.4.6443 > 192.168.0.8.47826: Flags [S.], seq 1046468779, ack 2088431776, win 28960, options [mss 1460,sackOK,TS val 2541197 ecr 1314340,nop,wscale 7], length 0
E..<..@.@.._.........+..>_..|z....q ...........
.&.....$....
14:23:52.503022 IP 192.168.0.8.47826 > 192.168.0.4.6443: Flags [.], ack 1, win 221, options [nop,nop,TS val 1314340 ecr 2541197], length 0
E..4..@.@..............+|z..>_.............
...$.&..
14:23:52.503757 IP 192.168.0.8.55951 > google-public-dns-a.google.com.domain: 62886+ PTR? 4.0.168.192.in-addr.arpa. (42)
E..F7.@.@.2\...........5.2...............4.0.168.192.in-addr.arpa.....
14:23:52.509060 IP google-public-dns-a.google.com.domain > 192.168.0.8.55951: 62886 NXDomain 0/0/0 (42)
E..F....{............5...2Q].............4.0.168.192.in-addr.arpa.....
14:23:52.568347 IP 192.168.0.8.47826 > 192.168.0.4.6443: Flags [P.], seq 1:248, ack 1, win 221, options [nop,nop,TS val 1314356 ecr 2541197], length 247
E..+..@.@..............+|z..>_.......z.....
...4.&.............[.. ..j.O.....!.....\u....9X......l.+.,.....	.#.
.$.r.s......./.0.......'...(.v.w.......z.{./.<.5.=.A...........
.....|.}.3.g.9.k.E...............Y.......................#...
...
...............................................	.http/1.1
14:23:52.568710 IP 192.168.0.4.6443 > 192.168.0.8.47826: Flags [.], ack 248, win 235, options [nop,nop,TS val 2541213 ecr 1314356], length 0
E..4.!@.@..F.........+..>_..|z.............
.&.....4
14:23:52.576082 IP 192.168.0.4.6443 > 192.168.0.8.47826: Flags [P.], seq 1:1432, ack 248, win 235, options [nop,nop,TS val 2541215 ecr 1314356], length 1431
E...."@.@............+..>_..|z.............
.&.....4....D...@....r.{..HN@.B.".0..(.u-M.(J.?....../....#............	.http/1.1...............0..|0..d.......5. _.y..0..	*.H........0.1.0...U....kube-ca0...181112113048Z..191112113049Z0.1.0...U....kube-apiserver0.."0..	*.H.............0..
........a..(4..)....R.."x.c..>9.2.1...L.........X.....u.h.J,zCY.k.]!!.P!.D..n.cp......+)...B!Vy~....l.t..~...$...K..9......e........9....4I...;.....,.T..S..b..R.cP..F..aQ.......:@....I&.{.d.t.=..P.jz.....5.l ..:..7....:vQ......S....!.UK...<.w...s....5..................0..0...U...........0...U.%..0...+.........+.......0....U.....0....master-zz-3.	localhost.
kubernetes..kubernetes.default..kubernetes.default.svc.$kubernetes.default.svc.cluster.local..
...........
+..0..	*.H.............?.J.24...7.zt.%..:......z...O
..o../... .9.....(..=.._p,i.....h~).=d..:......auy5.t.....:..C.....g...y.........P..3_>.y.'.i..%..=......S..8.).....5.......o.Y.....)..(.gQ1B1/gy....`....M.F...;..Jq......8..<....Z...I..8w?.S.og..-.y..@.C^..9....`...vy.....ie.....M...I...A...M..
.....P...6....o.8|{..QY.<...
......{..	j.N.f#z....0@...-........] ...$ffh../T9.....H/=..........*.5.....P.N..h.sX..yv.....&gV.0..........]	V.5^rAt.Q2.x..l.%...a..8j++.....GNk.....IJ,..............K
.Q5...#...gi..*Y{.{.V..3(..f^o.n.Pw.8.....h....}<Z...xN43...R!....Rm}.L'....ck.J...	|.Z..e.^...'..G_.K......<.|-...?..F....._...[..@...................D..0.1.0...U....kube-ca.,0*1(0&..U....kube-apiserver-requestheader-ca.........
14:23:52.576150 IP 192.168.0.8.47826 > 192.168.0.4.6443: Flags [.], ack 1432, win 243, options [nop,nop,TS val 1314358 ecr 2541215], length 0
E..4..@.@..............+|z..>_.C...........
...6.&..
14:23:52.577960 IP 192.168.0.8.47826 > 192.168.0.4.6443: Flags [P.], seq 248:260, ack 1432, win 243, options [nop,nop,TS val 1314359 ecr 2541215], length 12
E..@..@.@..............+|z..>_.C...........
...7.&..............
14:23:52.617407 IP 192.168.0.4.6443 > 192.168.0.8.47826: Flags [.], ack 260, win 235, options [nop,nop,TS val 2541226 ecr 1314359], length 0
E..4.$@.@..C.........+..>_.C|z.............
.&.....7
14:23:52.617483 IP 192.168.0.8.47826 > 192.168.0.4.6443: Flags [P.], seq 260:386, ack 1432, win 243, options [nop,nop,TS val 1314369 ecr 2541226], length 126
E.....@.@..(...........+|z..>_.C...........
...A.&......F...BA.t`.e^#br'#.
.a3.c._.FC..ra...*..	..a.U.."KYi.j..}u...C.X2.D....Q..........(.........a..S.=.
.e..|..CR.7.>$Qt.S..D)6
14:23:52.617645 IP 192.168.0.4.6443 > 192.168.0.8.47826: Flags [.], ack 386, win 235, options [nop,nop,TS val 2541226 ecr 1314369], length 0
E..4.%@.@..B.........+..>_.C|z.!...........
.&.....A
14:23:52.618294 IP 192.168.0.4.6443 > 192.168.0.8.47826: Flags [P.], seq 1432:1618, ack 386, win 235, options [nop,nop,TS val 2541226 ecr 1314369], length 186
E....&@.@............+..>_.C|z.!.....=.....
.&.....A........~.....x.o...).(.....AUG..$...u.......jdw...e}S..H.!.............._...t..7.qu..b..U...E...M.....Xy.ed).^.3.R.%..cR.^...gI.lp..VB..........(.........b.D...O.......B	.x..N.$.1s..7.\
14:23:52.620893 IP 192.168.0.8.47826 > 192.168.0.4.6443: Flags [P.], seq 386:499, ack 1618, win 265, options [nop,nop,TS val 1314370 ecr 2541226], length 113
E.....@.@..4...........+|z.!>_.....	.......
...B.&......l.........qVZ{<...~....^-.....R-..mQ9.../G~.3..........k...-.N..v}...F...3...C"..fDgF.....}.x..bL..p..R.2K..E
14:23:52.621672 IP 192.168.0.4.6443 > 192.168.0.8.47826: Flags [P.], seq 1618:2067, ack 499, win 235, options [nop,nop,TS val 2541227 ecr 1314370], length 449
E....'@.@............+..>_..|z.......D.....
.&.....B...............9	e..&.....A...,.d...F.Q.Z.."w............T"...-f%fX%...;5....eg...fz.._....HE"&wScJz..	.......\	.l.2..9....I...).@...,.K..:...1...D:+.....iZ./.Y. R.b.`t.y.(...]..\..p".
"&L.O..M. .,...2...@.{....d.....h.],...x~..P..d.]V.....R...D.0........Qw.+.;..7.)..|TOz......9L|Ru.w<_..{#.....uy..@K..#......]....~...%.G.?>..oe.c.......-..C.$.`...$.s....4.Z.D.....i...w"...R.Q.De....u.U..T..l..G.M^.q....q{	En.A.............f...*P..rd......#!.A..
14:23:52.622280 IP 192.168.0.8.47826 > 192.168.0.4.6443: Flags [P.], seq 499:530, ack 2067, win 287, options [nop,nop,TS val 1314370 ecr 2541227], length 31
E..S..@.@..............+|z..>_.............
...B.&.................^S.........yUUJ-
14:23:52.622723 IP 192.168.0.4.6443 > 192.168.0.8.47826: Flags [P.], seq 2067:2098, ack 530, win 235, options [nop,nop,TS val 2541227 ecr 1314370], length 31
E..S.(@.@.. .........+..>_..|z.............
.&.....B................?5.T.V..:.N..d8
14:23:52.622741 IP 192.168.0.4.6443 > 192.168.0.8.47826: Flags [F.], seq 2098, ack 530, win 235, options [nop,nop,TS val 2541227 ecr 1314370], length 0
E..4.)@.@..>.........+..>_..|z.............
.&.....B
14:23:52.632914 IP 192.168.0.8.47826 > 192.168.0.4.6443: Flags [R.], seq 530, ack 2099, win 287, options [nop,nop,TS val 1314373 ecr 2541227], length 0
E..4..@.@..............+|z..>_.............
...E.&..
14:23:52.633441 IP 192.168.0.4.6443 > 192.168.0.8.47826: Flags [F.], seq 2098, ack 530, win 235, options [nop,nop,TS val 2541230 ecr 1314370], length 0
E..4.*@.@..=.........+..>_..|z.............
.&.....B
14:23:52.633484 IP 192.168.0.8.47826 > 192.168.0.4.6443: Flags [R], seq 2088432305, win 0, length 0
E..(..@.@..............+|z......P....Y..
14:23:52.780481 ARP, Request who-has 192.168.0.5 tell 192.168.0.8, length 28
```

**Comment by mirkomikulic** [comment]
Update: We just found out supplying an --advertise-address seems to fix the issue. 
But that won't really work in our case since we cannot supply an advertise-address for each master, right?

**Comment by micw** [comment]
I think passing advertise-address via cluster yaml would not work because we'd need one per api-server. It's up ro rancher / rke to pass the correct advertise-address to apiserver it the node is launched with --internal-address.
You can see the wrong addresses that are registered to this service by command:

    kubectl get endpoints kubernetes
