### ISSUE TITLE
Container does not fail over even when network agent is running

### ISSUE THREAD

**Issue by deitch** [rancher/rancher#2331]
Referencing https://github.com/rancher/rancher/issues/1877 and the bug https://github.com/rancher/rancher/issues/2287

I have a network agent explicitly started, I pulled the plug on one host, yet the service *still* does not fail over.

The health check indicates that the container is in healthy state, but it has no last timestamp.

Here is what we did:

1. Set up a new stack
2. Set up a new service "Failover1"
3. Set the new service to scale=1, health check port 22 (see attached config), network managed
4. Start another managed container (ubuntu) on all other hosts to ensure that the network agent is started on all hosts.
5. Start the "Failover1" service with `scale=1`
6. Kill docker on the first host
7. Watch the container not fail over

Relying on the sql from the referenced article, we used "View in API" to get the container ID (`125`), then use SQL to get the state:

````sql
mysql> select id from healthcheck_instance where instance_id=125;
+----+
| id |
+----+
| 10 |
+----+
1 row in set (0.00 sec)

mysql> select * from healthcheck_instance_host_map where healthcheck_instance_id=10;
+----+------+------------+----------------------------+--------------------------------------+-------------+--------+---------------------+---------+-------------+------+-------------------------+---------+--------------------+--------------+
| id | name | account_id | kind                       | uuid                                 | description | state  | created             | removed | remove_time | data | healthcheck_instance_id | host_id | external_timestamp | health_state |
+----+------+------------+----------------------------+--------------------------------------+-------------+--------+---------------------+---------+-------------+------+-------------------------+---------+--------------------+--------------+
| 21 | NULL |         10 | healthcheckInstanceHostMap | 97995a61-4c7c-4e5e-b0d7-9951ff852230 | NULL        | active | 2015-10-13 14:14:59 | NULL    | NULL        | {}   |                      10 |       5 |               NULL | healthy      |
+----+------+------------+----------------------------+--------------------------------------+-------------+--------+---------------------+---------+-------------+------+-------------------------+---------+--------------------+--------------+
1 row in set (0.00 sec)
````

Note that the health check is coming fro the other host, shows it is `healthy`, but has no timestamp for last health check.

Looking in the UI and `docker ps` I see that the network agent is running:

````bash
# docker ps
CONTAINER ID        IMAGE                                                      COMMAND                  CREATED             STATUS              PORTS                                          NAMES
41cb2c5c7f4a        ubuntu:14.04.2                                             "/bin/bash"              37 minutes ago      Up 37 minutes                                                      32cd7df6-8d15-440c-b09b-f4022cb689f7
b9e323ca1cee        rancher/agent-instance:v0.4.1                              "/etc/init.d/agent-in"   38 minutes ago      Up 38 minutes       0.0.0.0:500->500/udp, 0.0.0.0:4500->4500/udp   af7dd448-5f90-43ea-a8c9-607f0f891131
b200a4f9e813        rancher/agent:v0.8.2                                       "/run.sh run"            3 weeks ago         Up 3 weeks                                                         rancher-agent
````

Here is the output of logs from the network agent:

````bash
# docker logs b9e323ca1cee
INFO: Downloading agent http://rancherserver:8080/v1/configcontent/configscripts
INFO: Updating configscripts
INFO: Downloading http://rancherserver:8080/v1//configcontent//configscripts current=
INFO: Running /var/lib/cattle/download/configscripts/configscripts-2-f5763391fb7914dcd14001f29ffe28d1167a3bfcc0ee0ec05d2ca9c722103c02/apply.sh
INFO: Sending configscripts applied 2-f5763391fb7914dcd14001f29ffe28d1167a3bfcc0ee0ec05d2ca9c722103c02
INFO: Updating agent-instance-startup
INFO: Downloading http://rancherserver:8080/v1//configcontent//agent-instance-startup current=
INFO: Running /var/lib/cattle/download/agent-instance-startup/agent-instance-startup-2-4e3d8498e82009968266220fe1813bc501968ea5af097d41b6734d40e9efda0c/apply.sh
INFO: Updating services
INFO: Downloading http://rancherserver:8080/v1//configcontent//services current=
INFO: Running /var/lib/cattle/download/services/services-2-061405f3edd960bfdfe1cfb8447be40eab5b4b608731608e224cc51c5dc30b91/apply.sh
INFO: HOME -> ./
INFO: HOME -> ./services
INFO: Sending services applied 2-061405f3edd960bfdfe1cfb8447be40eab5b4b608731608e224cc51c5dc30b91
INFO: Getting agent-instance-scripts
INFO: Updating agent-instance-scripts
INFO: Downloading http://rancherserver:8080/v1//configcontent//agent-instance-scripts current=
INFO: Running /var/lib/cattle/download/agent-instance-scripts/agent-instance-scripts-2-4b5124bd74cd423f98d57550b481ec77ec3a7135c6a650886ab95c043305d642/apply.sh
INFO: HOME -> ./
INFO: HOME -> ./events/
INFO: HOME -> ./events/ping
INFO: HOME -> ./events/config.update
INFO: Sending agent-instance-scripts applied 2-4b5124bd74cd423f98d57550b481ec77ec3a7135c6a650886ab95c043305d642
INFO: Getting monit
INFO: Updating monit
INFO: Downloading http://rancherserver:8080/v1//configcontent//monit current=
INFO: Running /var/lib/cattle/download/monit/monit-2-d166a713486fe4c0f039e152939d8d3b8ab8e6c2518e13d88f0b7ec68da46109/apply.sh
INFO: ROOT -> ./
INFO: ROOT -> ./etc/
INFO: ROOT -> ./etc/monit/
INFO: ROOT -> ./etc/monit/monitrc
INFO: Sending monit applied 2-d166a713486fe4c0f039e152939d8d3b8ab8e6c2518e13d88f0b7ec68da46109
INFO: Getting node-services
INFO: Updating node-services
INFO: Downloading http://rancherserver:8080/v1//configcontent//node-services current=
INFO: Running /var/lib/cattle/download/node-services/node-services-1-9e3dcab12585149a65d818082279708965cd826df1937a55b24f48428f8f0c0632de871aeae6eb33210844796d96e8ef/apply.sh
INFO: Updating rancher-metadata
INFO: Downloading http://rancherserver:8080/v1//configcontent//rancher-metadata current=
INFO: Running /var/lib/cattle/download/rancher-metadata/1-638d18c2ef29b482df0cd47ce09f435a428484eb0631e187bba414fbad298535/apply.sh
INFO: HOME -> ./
INFO: HOME -> ./bin/
INFO: HOME -> ./bin/rancher-metadata
INFO: ROOT -> ./
INFO: ROOT -> ./etc/
INFO: ROOT -> ./etc/monit/
INFO: ROOT -> ./etc/monit/conf.d/
INFO: ROOT -> ./etc/monit/conf.d/rancher-metadata
INFO: ROOT -> ./etc/init.d/
INFO: ROOT -> ./etc/init.d/rancher-metadata
 * rancher-metadata is not running
 * Starting rancher-metadata configuration rancher-metadata
   ...done.
INFO: Sending rancher-metadata applied 1-638d18c2ef29b482df0cd47ce09f435a428484eb0631e187bba414fbad298535
INFO: Updating rancher-dns
INFO: Downloading http://rancherserver:8080/v1//configcontent//rancher-dns current=
INFO: Running /var/lib/cattle/download/rancher-dns/1-f7a323a556662cba4edbce4b10c3e41fa93247776a7e1f7f963805cf33ce85a4/apply.sh
INFO: HOME -> ./
INFO: HOME -> ./bin/
INFO: HOME -> ./bin/rancher-dns
INFO: ROOT -> ./
INFO: ROOT -> ./etc/
INFO: ROOT -> ./etc/monit/
INFO: ROOT -> ./etc/monit/conf.d/
INFO: ROOT -> ./etc/monit/conf.d/rancher-dns
INFO: ROOT -> ./etc/init.d/
INFO: ROOT -> ./etc/init.d/rancher-dns
 * rancher-dns is not running
 * Starting rancher-dns configuration rancher-dns
   ...done.
INFO: Sending rancher-dns applied 1-f7a323a556662cba4edbce4b10c3e41fa93247776a7e1f7f963805cf33ce85a4
INFO: Updating host-api
INFO: Downloading http://rancherserver:8080/v1//configcontent//host-api current=
INFO: Running /var/lib/cattle/download/host-api/1-e25a5d16fcb285429fa40b24d09523d21b646c631a1f7f1e4c13cf95455cdff3/apply.sh
INFO: Sending host-api applied 1-e25a5d16fcb285429fa40b24d09523d21b646c631a1f7f1e4c13cf95455cdff3
INFO: Sending node-services applied 1-9e3dcab12585149a65d818082279708965cd826df1937a55b24f48428f8f0c0632de871aeae6eb33210844796d96e8ef
INFO: Getting ipsec
INFO: Updating ipsec
INFO: Downloading http://rancherserver:8080/v1//configcontent//ipsec current=
INFO: Running /var/lib/cattle/download/ipsec/ipsec-1-40f2ea763539783cdd77428ca414692f86aad20943573337f1e8eb843b61168e/apply.sh
INFO: ROOT -> ./
INFO: ROOT -> ./etc/
INFO: ROOT -> ./etc/monit/
INFO: ROOT -> ./etc/monit/conf.d/
INFO: ROOT -> ./etc/monit/conf.d/racoon
INFO: ROOT -> ./etc/racoon/
INFO: ROOT -> ./etc/racoon/racoon.conf
INFO: ROOT -> ./etc/racoon/psk.txt
INFO: ROOT -> ./etc/default/
INFO: ROOT -> ./etc/default/racoon
 * Restarting IKE (ISAKMP/Oakley) server racoon
   ...done.
INFO: Sending ipsec applied 1-40f2ea763539783cdd77428ca414692f86aad20943573337f1e8eb843b61168e
INFO: Getting healthcheck
INFO: Updating healthcheck
INFO: Downloading http://rancherserver:8080/v1//configcontent//healthcheck current=
INFO: Running /var/lib/cattle/download/healthcheck/healthcheck-2-464be13ed9f0356d28455d3ca4a83d47177dbe2055fb0b0f3f9292ff2b6c6a88/apply.sh
INFO: ROOT -> ./
INFO: ROOT -> ./etc/
INFO: ROOT -> ./etc/healthcheck/
INFO: ROOT -> ./etc/healthcheck/healthcheck.cfg
INFO: ROOT -> ./etc/monit/
INFO: ROOT -> ./etc/monit/conf.d/
INFO: ROOT -> ./etc/monit/conf.d/healthcheck
INFO: ROOT -> ./etc/monit/conf.d/haproxy-monitor
INFO: ROOT -> ./etc/init.d/
INFO: ROOT -> ./etc/init.d/haproxy-monitor
INFO: ROOT -> ./etc/default/
INFO: ROOT -> ./etc/default/haproxy
INFO: ROOT -> ./etc/default/haproxy-monitor
INFO: Sending healthcheck applied 2-464be13ed9f0356d28455d3ca4a83d47177dbe2055fb0b0f3f9292ff2b6c6a88
INFO: Getting host-iptables
INFO: Updating host-iptables
INFO: Downloading http://rancherserver:8080/v1//configcontent//host-iptables current=
INFO: Running /var/lib/cattle/download/host-iptables/host-iptables-1-d049e47d422e7c2556577ff35624f118e182ec70793d23712724afa2f3165683/apply.sh
INFO: HOME -> ./
INFO: HOME -> ./etc/
INFO: HOME -> ./etc/cattle/
INFO: HOME -> ./etc/cattle/host-iptables
INFO: Sending host-iptables applied 1-d049e47d422e7c2556577ff35624f118e182ec70793d23712724afa2f3165683
INFO: Getting ipsec-hosts
INFO: Updating ipsec-hosts
INFO: Downloading http://rancherserver:8080/v1//configcontent//ipsec-hosts current=
INFO: Running /var/lib/cattle/download/ipsec-hosts/ipsec-hosts-1-0ae365b7258d2059101719aeca0f6b708bf43153214ab891f171d1b0cb90a8e6/apply.sh
INFO: HOME -> ./
INFO: HOME -> ./etc/
INFO: HOME -> ./etc/cattle/
INFO: HOME -> ./etc/cattle/ipsec-tunnel-routes
INFO: HOME -> ./etc/cattle/setkey
INFO: Sending ipsec-hosts applied 1-0ae365b7258d2059101719aeca0f6b708bf43153214ab891f171d1b0cb90a8e6
INFO: Getting hosts
INFO: Updating hosts
INFO: Downloading http://rancherserver:8080/v1//configcontent//hosts current=
INFO: Running /var/lib/cattle/download/hosts/hosts-1-256d5e84d0d14b6fafb7adee4ecf4bbd598caffc2d2810fab610f75a277ab696/apply.sh
INFO: HOME -> ./
INFO: HOME -> ./etc/
INFO: HOME -> ./etc/cattle/
INFO: HOME -> ./etc/cattle/metadata/
INFO: HOME -> ./etc/cattle/metadata/answers.json
INFO: HOME -> ./etc/cattle/dns/
INFO: HOME -> ./etc/cattle/dns/answers.json
 * Starting rancher-dns configuration rancher-dns
   ...done.
 * Starting rancher-metadata configuration rancher-metadata
   ...done.
INFO: Sending hosts applied 1-256d5e84d0d14b6fafb7adee4ecf4bbd598caffc2d2810fab610f75a277ab696
INFO: Getting iptables
INFO: Updating iptables
INFO: Downloading http://rancherserver:8080/v1//configcontent//iptables current=
INFO: Running /var/lib/cattle/download/iptables/iptables-1-d17e39be7848593f597ccce7e95920bbb0b9fc963abba8f278e79e0a13795824/apply.sh
INFO: HOME -> ./
INFO: HOME -> ./etc/
INFO: HOME -> ./etc/cattle/
INFO: HOME -> ./etc/cattle/iptables-save
INFO: Sending iptables applied 1-d17e39be7848593f597ccce7e95920bbb0b9fc963abba8f278e79e0a13795824
INFO: HOME -> ./
INFO: HOME -> ./etc/
INFO: HOME -> ./etc/cattle/
INFO: HOME -> ./etc/cattle/startup-env
INFO: ROOT -> ./
INFO: ROOT -> ./etc/
INFO: ROOT -> ./etc/init.d/
INFO: ROOT -> ./etc/init.d/agent-instance-startup
INFO: Sending agent-instance-startup applied 2-4e3d8498e82009968266220fe1813bc501968ea5af097d41b6734d40e9efda0c
monit: generated unique Monit id 6ddb06811e789efce389f58d6636d126 and stored to '/var/lib/monit/id'
Starting monit daemon with http interface at [localhost:2812]
````

And finally config for the container:

````json
{
"id": "1i125",
"type": "container",
"links": {
"self": "…/v1/projects/1a10/containers/1i125",
"account": "…/v1/projects/1a10/containers/1i125/account",
"credentials": "…/v1/projects/1a10/containers/1i125/credentials",
"hosts": "…/v1/projects/1a10/containers/1i125/hosts",
"instanceLabels": "…/v1/projects/1a10/containers/1i125/instancelabels",
"instanceLinks": "…/v1/projects/1a10/containers/1i125/instancelinks",
"instances": "…/v1/projects/1a10/containers/1i125/instances",
"loadBalancerTargets": "…/v1/projects/1a10/containers/1i125/loadbalancertargets",
"mounts": "…/v1/projects/1a10/containers/1i125/mounts",
"ports": "…/v1/projects/1a10/containers/1i125/ports",
"serviceEvents": "…/v1/projects/1a10/containers/1i125/serviceevents",
"serviceExposeMaps": "…/v1/projects/1a10/containers/1i125/serviceexposemaps",
"services": "…/v1/projects/1a10/containers/1i125/services",
"targetInstanceLinks": "…/v1/projects/1a10/containers/1i125/targetinstancelinks",
"volumes": "…/v1/projects/1a10/containers/1i125/volumes",
"stats": "…/v1/projects/1a10/containers/1i125/stats",
"containerStats": "…/v1/projects/1a10/containers/1i125/containerstats",
},
"actions": {
"update": "…/v1/projects/1a10/containers/1i125/?action=update",
"stop": "…/v1/projects/1a10/containers/1i125/?action=stop",
"restart": "…/v1/projects/1a10/containers/1i125/?action=restart",
"migrate": "…/v1/projects/1a10/containers/1i125/?action=migrate",
"logs": "…/v1/projects/1a10/containers/1i125/?action=logs",
"setlabels": "…/v1/projects/1a10/containers/1i125/?action=setlabels",
"execute": "…/v1/projects/1a10/containers/1i125/?action=execute",
},
"name": "lmpa_FailOver1_1",
"state": "running",
"accountId": "1a10",
"build": null,
"capAdd": [ ],
"capDrop": [ ],
"command": null,
"cpuSet": null,
"cpuShares": null,
"createIndex": 1,
"created": "2015-10-13T14:14:59Z",
"createdTS": 1444745699000,
"dataVolumes": [ ],
"dataVolumesFrom": [ ],
"description": null,
"devices": [ ],
"dns": [ ],
"dnsSearch": [ ],
"domainName": null,
"entryPoint": null,
"environment": {
"A_pipework_cmd_public": "eth0 @CONTAINER_NAME@ 10.0.5.216/16@10.0.0.1",
"B_pipework_cmd_private": "dummy -i eth2 @CONTAINER_NAME@ 192.168.1.101/24@192.168.1.1",
"C_pipework_cmd_multicast": "route @CONTAINER_NAME@ replace 224.0.0.0/4 via 192.168.1.101",
"D_pipework_cmd_DG": "route @CONTAINER_NAME@ replace 0.0.0.0/0 via 10.0.0.1",
},
"expose": null,
"externalId": "2a8c717c9bb9c7522a39858cff62604f72148e7de23252b7981494a01cfb2964",
"extraHosts": null,
"firstRunning": "2015-10-13T14:15:15Z",
"firstRunningTS": 1444745715000,
"healthCheck": {
"interval": 2000,
"responseTimeout": 2000,
"healthyThreshold": 2,
"unhealthyThreshold": 3,
"requestLine": "",
"port": 22,
},
"healthState": "initializing",
"hostname": "lmpatesttest",
"imageUuid": "docker:imagehub.corp.tradertools.com/tradertools/tt-ecn:8.6.3-009",
"kind": "container",
"labels": {
"io.rancher.project.name": "lmpa",
"io.rancher.service.deployment.unit": "b6fc9b97-2163-4086-9e78-a2e1d3206a93",
"io.rancher.service.launch.config": "io.rancher.service.primary.launch.config",
"io.rancher.project_service.name": "lmpa/FailOver1",
"io.rancher.scheduler.affinity:container_label_soft": "io.rancher.service.deployment.unit=b6fc9b97-2163-4086-9e78-a2e1d3206a93",
"io.rancher.stack.name": "lmpa",
"io.rancher.stack_service.name": "lmpa/FailOver1",
},
"logConfig": null,
"lxcConf": null,
"memory": null,
"memorySwap": null,
"nativeContainer": false,
"networkContainerId": null,
"networkMode": "managed",
"pidMode": null,
"ports": [ ],
"primaryIpAddress": "10.42.102.113",
"privileged": false,
"publishAllPorts": false,
"readOnly": false,
"registryCredentialId": null,
"removed": null,
"requestedHostId": null,
"restartPolicy": {
"name": "always",
},
"securityOpt": null,
"startOnCreate": true,
"stdinOpen": true,
"systemContainer": null,
"transitioning": "no",
"transitioningMessage": null,
"transitioningProgress": null,
"tty": true,
"user": null,
"uuid": "cf9335ef-f48e-4273-bb60-85b0a5fa0d34",
"volumeDriver": null,
"workingDir": null,
}
````

**Comment by alena1108** [comment]
@deitch given the info (thanks for all the details btw), looks like the initial healthcheck was never successful. External_timestamp being null in the DB and "healthState"="initializing" clearly indicates it.

Just to double check - host id=5 - is not the one where container got started? If not, there can be 2 reasons for this behavior:

Reason 1:  port for the heatlcheck is not open for tcp connection on the container. Its very easy to test - launch the service container on a healthy host, and from the network agent do "telnet <containerip> <healthcheck port>. If connection is refused, then the healtcheck has to be reconfigured with he accessible tcp port. But most likely you've tested it already, so moving on to Reason 2

Reason 2: step5 - failover - was executed before network agent on another host had a chance to establish a successful healtcheck against the container. Today in Rancher there is no state transition initializing->unhealthy; only initializing->healthy->unhealthy->healthy.... It was done:

* to give container some time to come up and get ready for healtcheck
* to avoid infinite re-creation for containers where healtheck is misconfigured. 

We should be smarter initial state transition - perhaps introduce initial timeout, and when its reached, initializing->unhealthy should be allowed. 

Let me know if think anything of the above - host id=5 is the host where container runs, or failover executed too soon  - happened during your test.

**Comment by deitch** [comment]
@alena1108 correct, `host_id=5` is a different host than the one where the container is.

Yes, the tcp port (22) is open on the container. If it weren't, then the check actually should have failed, rather than been in an indeterminate state, right? Either way, definitely open.

No, we waited some time before doing the failover.

I understand why you would want to have an ensured `healthy` state before enabling transition and infinite recreation, but that did not happen here. And, yes, a timeout following which initializing->unhealthy is valid makes sense too.

I am about to retry the test, including validating port. Can you think of anything else?

**Comment by deitch** [comment]
Yes, I am seeing the same thing again right now. The container is running on one host, the health check in SQL shows *exactly* the same thing. 

Two data points:

1. I just started another container (call it `tester`), with Rancher-managed networking, so it is on the same network as my test container (call it `failover`). I then tried to connect to 22 on `failover` and could not connect. Is that because I did not enable connectivity between them?

2. I did not map port 22 using standard Docker NAT, since, the health checks use rancher-managed networking, so the NAT on the host should be irrelevant. I definitely can connect to 22 from `failover` itself (i.e. sshd is running).

**Comment by alena1108** [comment]
@deitch 

1) Are containers running on the same host? If different, can all the hosts communicate (UDP 4500 and 500 have to be opened)?  

And you don't have to enable any connectivity for the containers; all containers of the same environment should be able to access each other by ip

2) You don't have any extra iptables rules. As long as containers are on the same Rancher managed network, they should be able to communicate.

If you can't connect from "tester" to "failover"'s port 22, most likely network agent also can't connect to it. Thats how healtcheck is done - networkAgent tries to establish tcp connection to the healtcheckport/ip of the container.

**Comment by deitch** [comment]
Nope, definitely not the same host. FWIW, inside Rancher, one is host_id 5, the other is host_id 2.

I don't believe we have any extra iptables rules and these are all on the same subnet. But I am checking again right now.

As for `tester` to `failover`, those should go over the IPSec network, right? As should the network agent attempts?

So I definitely can ping from one host to another, as well as ssh. So I know tcp, icmp are both open. And they definitely are on the same network 10.0.0.0/16. 

Interestingly, I ran tcpdump on the host with the container that should fail over, listening for any packets from the host where the network agent is running. See this output. I renamed the hosts to make it cleaner; `checker` is where the health check is running, `runner` is where the container I expect to fail over is running.

````
19:31:37.981542 IP checker.1024 > runner.isakmp: isakmp: phase 1 I agg
19:31:37.981584 IP runner > checker: ICMP host runner unreachable - admin prohibited, length 420
19:31:42.992471 ARP, Request who-has checker tell runner, length 28
19:31:42.992951 ARP, Reply checker is-at 00:24:81:1d:7f:e6 (oui Unknown), length 46
````

I also did a netstat on `runner` to see what is listening:

````
# netstat -plunt
Active Internet connections (only servers)
Proto Recv-Q Send-Q Local Address           Foreign Address         State       PID/Program name
tcp        0      0 0.0.0.0:22              0.0.0.0:*               LISTEN      1536/sshd
tcp        0      0 127.0.0.1:25            0.0.0.0:*               LISTEN      2630/master
tcp        0      0 127.0.0.1:9344          0.0.0.0:*               LISTEN      15790/.cadvisor
tcp6       0      0 :::139                  :::*                    LISTEN      2671/docker-proxy
tcp6       0      0 :::6379                 :::*                    LISTEN      2638/docker-proxy
tcp6       0      0 :::22                   :::*                    LISTEN      1536/sshd
tcp6       0      0 :::88                   :::*                    LISTEN      2678/docker-proxy
tcp6       0      0 ::1:25                  :::*                    LISTEN      2630/master
tcp6       0      0 :::445                  :::*                    LISTEN      2664/docker-proxy
udp        0      0 0.0.0.0:3966            0.0.0.0:*                           5419/dhclient
udp        0      0 0.0.0.0:5353            0.0.0.0:*                           911/avahi-daemon: r
udp        0      0 0.0.0.0:46447           0.0.0.0:*                           911/avahi-daemon: r
udp        0      0 0.0.0.0:68              0.0.0.0:*                           5419/dhclient
udp        0      0 0.0.0.0:123             0.0.0.0:*                           901/chronyd
udp        0      0 127.0.0.1:323           0.0.0.0:*                           901/chronyd
udp6       0      0 :::4500                 :::*                                16449/docker-proxy
udp6       0      0 :::41454                :::*                                5419/dhclient
udp6       0      0 :::123                  :::*                                901/chronyd
udp6       0      0 ::1:323                 :::*                                901/chronyd
udp6       0      0 :::500                  :::*                                16473/docker-proxy
````

I see `docker-proxy` listening on ump 500 and 4500... of `udp6`, but not `udp`.

Last, I did `iptables -L` (also on `runner`). Unfortunately, it is quite busy, between docker and rancher-agent. But here it is:

````
# iptables -L
Chain INPUT (policy ACCEPT)
target     prot opt source               destination
ACCEPT     all  --  anywhere             anywhere             ctstate RELATED,ESTABLISHED
ACCEPT     all  --  anywhere             anywhere
INPUT_direct  all  --  anywhere             anywhere
INPUT_ZONES_SOURCE  all  --  anywhere             anywhere
INPUT_ZONES  all  --  anywhere             anywhere
ACCEPT     icmp --  anywhere             anywhere
REJECT     all  --  anywhere             anywhere             reject-with icmp-host-prohibited

Chain FORWARD (policy ACCEPT)
target     prot opt source               destination
DOCKER     all  --  anywhere             anywhere
ACCEPT     all  --  anywhere             anywhere             ctstate RELATED,ESTABLISHED
ACCEPT     all  --  anywhere             anywhere
ACCEPT     all  --  anywhere             anywhere
ACCEPT     all  --  anywhere             anywhere             ctstate RELATED,ESTABLISHED
ACCEPT     all  --  anywhere             anywhere
FORWARD_direct  all  --  anywhere             anywhere
FORWARD_IN_ZONES_SOURCE  all  --  anywhere             anywhere
FORWARD_IN_ZONES  all  --  anywhere             anywhere
FORWARD_OUT_ZONES_SOURCE  all  --  anywhere             anywhere
FORWARD_OUT_ZONES  all  --  anywhere             anywhere
ACCEPT     icmp --  anywhere             anywhere
REJECT     all  --  anywhere             anywhere             reject-with icmp-host-prohibited

Chain OUTPUT (policy ACCEPT)
target     prot opt source               destination
OUTPUT_direct  all  --  anywhere             anywhere

Chain DOCKER (1 references)
target     prot opt source               destination
ACCEPT     udp  --  anywhere             172.17.0.2           udp dpt:ipsec-nat-t
ACCEPT     udp  --  anywhere             172.17.0.2           udp dpt:isakmp
ACCEPT     tcp  --  anywhere             172.17.0.5           tcp dpt:6379
ACCEPT     tcp  --  anywhere             172.17.0.5           tcp dpt:microsoft-ds
ACCEPT     tcp  --  anywhere             172.17.0.5           tcp dpt:netbios-ssn
ACCEPT     tcp  --  anywhere             172.17.0.5           tcp dpt:kerberos

Chain FORWARD_IN_ZONES (1 references)
target     prot opt source               destination
FWDI_public  all  --  anywhere             anywhere            [goto]
FWDI_public  all  --  anywhere             anywhere            [goto]
FWDI_public  all  --  anywhere             anywhere            [goto]

Chain FORWARD_IN_ZONES_SOURCE (1 references)
target     prot opt source               destination

Chain FORWARD_OUT_ZONES (1 references)
target     prot opt source               destination
FWDO_public  all  --  anywhere             anywhere            [goto]
FWDO_public  all  --  anywhere             anywhere            [goto]
FWDO_public  all  --  anywhere             anywhere            [goto]

Chain FORWARD_OUT_ZONES_SOURCE (1 references)
target     prot opt source               destination

Chain FORWARD_direct (1 references)
target     prot opt source               destination

Chain FWDI_public (3 references)
target     prot opt source               destination
FWDI_public_log  all  --  anywhere             anywhere
FWDI_public_deny  all  --  anywhere             anywhere
FWDI_public_allow  all  --  anywhere             anywhere

Chain FWDI_public_allow (1 references)
target     prot opt source               destination

Chain FWDI_public_deny (1 references)
target     prot opt source               destination

Chain FWDI_public_log (1 references)
target     prot opt source               destination

Chain FWDO_public (3 references)
target     prot opt source               destination
FWDO_public_log  all  --  anywhere             anywhere
FWDO_public_deny  all  --  anywhere             anywhere
FWDO_public_allow  all  --  anywhere             anywhere

Chain FWDO_public_allow (1 references)
target     prot opt source               destination

Chain FWDO_public_deny (1 references)
target     prot opt source               destination

Chain FWDO_public_log (1 references)
target     prot opt source               destination

Chain INPUT_ZONES (1 references)
target     prot opt source               destination
IN_public  all  --  anywhere             anywhere            [goto]
IN_public  all  --  anywhere             anywhere            [goto]
IN_public  all  --  anywhere             anywhere            [goto]

Chain INPUT_ZONES_SOURCE (1 references)
target     prot opt source               destination

Chain INPUT_direct (1 references)
target     prot opt source               destination

Chain IN_public (3 references)
target     prot opt source               destination
IN_public_log  all  --  anywhere             anywhere
IN_public_deny  all  --  anywhere             anywhere
IN_public_allow  all  --  anywhere             anywhere

Chain IN_public_allow (1 references)
target     prot opt source               destination
ACCEPT     tcp  --  anywhere             anywhere             tcp dpt:ssh ctstate NEW

Chain IN_public_deny (1 references)
target     prot opt source               destination

Chain IN_public_log (1 references)
target     prot opt source               destination

Chain OUTPUT_direct (1 references)
target     prot opt source               destination
````

**Comment by deitch** [comment]
Bump? Help, please?

**Comment by deniseschannon** [comment]
My understanding is that the failover doesn't work due to the ipsec issue that is reported here. http://forums.rancher.com/t/ipsec-between-two-hosts-not-setting-up-tunnel/818

Please correct me if I'm wrong @deitch

**Comment by deitch** [comment]
Yes, @deniseschannon it appears that is the issue. @alena1108 walked through it with me (thank you @alena1108 ) and it appears the tunnel is not being set up.

**Comment by deniseschannon** [comment]
I'm going to close this issue.
